name,link,upvotes,downvotes,year,order
Acqua di Giò Profumo Giorgio Armani (male) ~ 2015,https://www.fragrantica.com/perfume/Giorgio-Armani/Acqua-di-Gio-Profumo-29727.html,577,187,2015,1
Acqua di Giò Profondo Giorgio Armani (male) ~ 2020,https://www.fragrantica.com/perfume/Giorgio-Armani/Acqua-di-Gio-Profondo-59532.html,472,223,2020,2
Wood Sage & Sea Salt Jo Malone London (unisex) ~ 2014,https://www.fragrantica.com/perfume/Jo-Malone-London/Wood-Sage-Sea-Salt-25529.html,363,145,2014,3
Allure Homme Sport Chanel (male) ~ 2004,https://www.fragrantica.com/perfume/Chanel/Allure-Homme-Sport-607.html,319,152,2004,4
Cool Water Davidoff (male) ~ 1988,https://www.fragrantica.com/perfume/Davidoff/Cool-Water-507.html,317,175,1988,5
Acqua di Gio Giorgio Armani (male) ~ 1996,https://www.fragrantica.com/perfume/Giorgio-Armani/Acqua-di-Gio-410.html,269,119,1996,6
40 Knots Xerjoff (unisex) ~ 2012,https://www.fragrantica.com/perfume/Xerjoff/40-Knots-16445.html,249,93,2012,7
Aqva Pour Homme Bvlgari (male) ~ 2005,https://www.fragrantica.com/perfume/Bvlgari/Aqva-Pour-Homme-153.html,252,101,2005,8
Light Blue Eau Intense Pour Homme Dolce&Gabbana (male) ~ 2017,https://www.fragrantica.com/perfume/Dolce-Gabbana/Light-Blue-Eau-Intense-Pour-Homme-44035.html,247,91,2017,9
Light Blue Dolce&Gabbana (female) ~ 2001,https://www.fragrantica.com/perfume/Dolce-Gabbana/Light-Blue-485.html,266,163,2001,10
Versace Pour Homme Versace (male) ~ 2008,https://www.fragrantica.com/perfume/Versace/Versace-Pour-Homme-2318.html,211,69,2008,11
Megamare Orto Parisi (unisex) ~ 2019,https://www.fragrantica.com/perfume/Orto-Parisi/Megamare-53471.html,200,97,2019,12
Eau des Merveilles Bleue Hermès (female) ~ 2016,https://www.fragrantica.com/perfume/Hermes/Eau-des-Merveilles-Bleue-42747.html,185,89,2016,13
Acqua di Giò Parfum Giorgio Armani (male) ~ 2023,https://www.fragrantica.com/perfume/Giorgio-Armani/Acqua-di-Gio-Parfum-81508.html,165,62,2023,14
Kenzo Homme Eau de Parfum Kenzo (male) ~ 2022,https://www.fragrantica.com/perfume/Kenzo/Kenzo-Homme-Eau-de-Parfum-73225.html,162,62,2022,15
Pacific Rock Moss Goldfield & Banks Australia (unisex) ~ 2016,https://www.fragrantica.com/perfume/Goldfield-Banks-Australia/Pacific-Rock-Moss-44120.html,169,78,2016,16
Versace Man Eau Fraiche Versace (male) ~ 2006,https://www.fragrantica.com/perfume/Versace/Versace-Man-Eau-Fraiche-644.html,157,55,2006,17
Afternoon Swim Louis Vuitton (unisex) ~ 2019,https://www.fragrantica.com/perfume/Louis-Vuitton/Afternoon-Swim-53947.html,145,47,2019,18
Acqua di Gioia Giorgio Armani (female) ~ 2010,https://www.fragrantica.com/perfume/Giorgio-Armani/Acqua-di-Gioia-8442.html,143,56,2010,19
Millésime Impérial Creed (unisex) ~ 1995,https://www.fragrantica.com/perfume/Creed/Millesime-Imperial-466.html,157,92,1995,20
L'Eau d'Issey Pour Homme Issey Miyake (male) ~ 1994,https://www.fragrantica.com/perfume/Issey-Miyake/L-Eau-d-Issey-Pour-Homme-721.html,123,46,1994,21
Aqva Pour Homme Atlantiqve Bvlgari (male) ~ 2017,https://www.fragrantica.com/perfume/Bvlgari/Aqva-Pour-Homme-Atlantiqve-42856.html,126,64,2017,22
Aqva Pour Homme Marine Bvlgari (male) ~ 2008,https://www.fragrantica.com/perfume/Bvlgari/Aqva-Pour-Homme-Marine-1742.html,123,59,2008,23
Ganymede Marc-Antoine Barrois (unisex) ~ 2019,https://www.fragrantica.com/perfume/Marc-Antoine-Barrois/Ganymede-54720.html,131,78,2019,24
Sailing Day Maison Martin Margiela (unisex) ~ 2017,https://www.fragrantica.com/perfume/Maison-Martin-Margiela/Sailing-Day-47891.html,127,72,2017,25
Acqua di Sale Profumum Roma (unisex) ~ 2000,https://www.fragrantica.com/perfume/Profumum-Roma/Acqua-di-Sale-3886.html,114,55,2000,26
Costa Azzurra Tom Ford (unisex) ~ 2021,https://www.fragrantica.com/perfume/Tom-Ford/Costa-Azzurra-64617.html,123,79,2021,27
Nautica Voyage Nautica (male) ~ 2006,https://www.fragrantica.com/perfume/Nautica/Nautica-Voyage-913.html,122,77,2006,28
Aqva Amara Bvlgari (male) ~ 2014,https://www.fragrantica.com/perfume/Bvlgari/Aqva-Amara-22675.html,120,76,2014,29
Kenzo Homme Eau de Toilette Intense Kenzo (male) ~ 2021,https://www.fragrantica.com/perfume/Kenzo/Kenzo-Homme-Eau-de-Toilette-Intense-67899.html,105,54,2021,30
Neroli Portofino Tom Ford (unisex) ~ 2011,https://www.fragrantica.com/perfume/Tom-Ford/Neroli-Portofino-12192.html,111,67,2011,31
Versace Pour Homme Dylan Blue Versace (male) ~ 2016,https://www.fragrantica.com/perfume/Versace/Versace-Pour-Homme-Dylan-Blue-40031.html,94,35,2016,32
Womanity Mugler (female) ~ 2010,https://www.fragrantica.com/perfume/Mugler/Womanity-8766.html,101,59,2010,33
L'eau d'Issey Issey Miyake (female) ~ 1992,https://www.fragrantica.com/perfume/Issey-Miyake/L-eau-d-Issey-720.html,88,37,1992,34
Oud Minérale Tom Ford (unisex) ~ 2017,https://www.fragrantica.com/perfume/Tom-Ford/Oud-Minerale-45192.html,96,56,2017,35
Sedley Parfums de Marly (unisex) ~ 2019,https://www.fragrantica.com/perfume/Parfums-de-Marly/Sedley-56273.html,83,30,2019,36
Artisan Pure John Varvatos (male) ~ 2017,https://www.fragrantica.com/perfume/John-Varvatos/Artisan-Pure-46623.html,79,28,2017,37
Un Jardin Sur La Lagune Hermès (unisex) ~ 2019,https://www.fragrantica.com/perfume/Hermes/Un-Jardin-Sur-La-Lagune-53373.html,95,62,2019,38
Ocean di Gioia Giorgio Armani (female) ~ 2020,https://www.fragrantica.com/perfume/Giorgio-Armani/Ocean-di-Gioia-59809.html,77,43,2020,39
Chrome Azzaro (male) ~ 1996,https://www.fragrantica.com/perfume/Azzaro/Chrome-788.html,79,48,1996,40
Light Blue Forever pour Homme Dolce&Gabbana (male) ~ 2021,https://www.fragrantica.com/perfume/Dolce-Gabbana/Light-Blue-Forever-pour-Homme-66556.html,73,37,2021,41
Squid Zoologist Perfumes (unisex) ~ 2019,https://www.fragrantica.com/perfume/Zoologist-Perfumes/Squid-56294.html,77,46,2019,42
L’Homme Ideal Cologne Guerlain (male) ~ 2015,https://www.fragrantica.com/perfume/Guerlain/L-Homme-Ideal-Cologne-30620.html,68,29,2015,43
Eau des Merveilles Hermès (female) ~ 2004,https://www.fragrantica.com/perfume/Hermes/Eau-des-Merveilles-9.html,84,62,2004,44
Turathi Blue Afnan (male) ~ 2021,https://www.fragrantica.com/perfume/Afnan/Turathi-Blue-70839.html,68,32,2021,45
Sel Marin James Heeley (unisex),https://www.fragrantica.com/perfume/James-Heeley/Sel-Marin-7852.html,67,37,0,46
Acqua di Parma Blu Mediterraneo - Fico di Amalfi Acqua di Parma (unisex) ~ 2006,https://www.fragrantica.com/perfume/Acqua-di-Parma/Acqua-di-Parma-Blu-Mediterraneo-Fico-di-Amalfi-1687.html,54,11,2006,47
Un Jardin en Méditerranée Hermès (unisex) ~ 2003,https://www.fragrantica.com/perfume/Hermes/Un-Jardin-en-Mediterranee-19.html,65,34,2003,48
Acqua di Gio Essenza Giorgio Armani (male) ~ 2012,https://www.fragrantica.com/perfume/Giorgio-Armani/Acqua-di-Gio-Essenza-14825.html,71,46,2012,49
Hawas for Him Rasasi (male) ~ 2015,https://www.fragrantica.com/perfume/Rasasi/Hawas-for-Him-46890.html,79,64,2015,50
Light Blue pour Homme Italian Love Dolce&Gabbana (male) ~ 2022,https://www.fragrantica.com/perfume/Dolce-Gabbana/Light-Blue-pour-Homme-Italian-Love-72622.html,63,32,2022,51
Allure Homme Sport Eau Extreme Chanel (male) ~ 2012,https://www.fragrantica.com/perfume/Chanel/Allure-Homme-Sport-Eau-Extreme-14669.html,58,22,2012,52
Olympéa Paco Rabanne (female) ~ 2015,https://www.fragrantica.com/perfume/Paco-Rabanne/Olympea-31666.html,60,32,2015,53
EGE / ΑΙΓΑΙΟ Nishane (unisex) ~ 2020,https://www.fragrantica.com/perfume/Nishane/EGE-AIGAIO-64092.html,62,40,2020,54
Cool Water Intense Davidoff (male) ~ 2019,https://www.fragrantica.com/perfume/Davidoff/Cool-Water-Intense-55266.html,62,41,2019,55
Armani Privé Bleu Turquoise Giorgio Armani (unisex) ~ 2018,https://www.fragrantica.com/perfume/Giorgio-Armani/Armani-Prive-Bleu-Turquoise-48060.html,48,18,2018,56
Torino21 Xerjoff (unisex) ~ 2021,https://www.fragrantica.com/perfume/Xerjoff/Torino21-70424.html,49,23,2021,57
Missoni Wave Missoni (male) ~ 2020,https://www.fragrantica.com/perfume/Missoni/Missoni-Wave-61329.html,44,16,2020,58
Cool Water Davidoff (female) ~ 1996,https://www.fragrantica.com/perfume/Davidoff/Cool-Water-508.html,55,41,1996,59
Beach Hut Man Amouage (male) ~ 2017,https://www.fragrantica.com/perfume/Amouage/Beach-Hut-Man-46336.html,46,24,2017,60
Azzaro Chrome Extreme Azzaro (male) ~ 2020,https://www.fragrantica.com/perfume/Azzaro/Azzaro-Chrome-Extreme-59020.html,47,26,2020,61
Kenzo pour Homme Kenzo (male) ~ 1991,https://www.fragrantica.com/perfume/Kenzo/Kenzo-pour-Homme-77.html,52,38,1991,62
Green Irish Tweed Creed (male) ~ 1985,https://www.fragrantica.com/perfume/Creed/Green-Irish-Tweed-474.html,48,30,1985,63
Kenzo Homme Marine Kenzo (male) ~ 2023,https://www.fragrantica.com/perfume/Kenzo/Kenzo-Homme-Marine-80042.html,49,34,2023,64
Club de Nuit Milestone Armaf (unisex) ~ 2019,https://www.fragrantica.com/perfume/Armaf/Club-de-Nuit-Milestone-64104.html,48,34,2019,65
Light Blue Eau Intense Dolce&Gabbana (female) ~ 2017,https://www.fragrantica.com/perfume/Dolce-Gabbana/Light-Blue-Eau-Intense-44034.html,41,20,2017,66
Black Sea Lorenzo Pazzaglia (unisex) ~ 2019,https://www.fragrantica.com/perfume/Lorenzo-Pazzaglia/Black-Sea-69652.html,44,31,2019,67
Bohemian Lime Goldfield & Banks Australia (unisex) ~ 2020,https://www.fragrantica.com/perfume/Goldfield-Banks-Australia/Bohemian-Lime-60923.html,39,21,2020,68
Polo Blue Eau de Parfum Ralph Lauren (male) ~ 2016,https://www.fragrantica.com/perfume/Ralph-Lauren/Polo-Blue-Eau-de-Parfum-38051.html,39,23,2016,69
4711 Original Eau de Cologne 4711 (unisex),https://www.fragrantica.com/perfume/4711/4711-Original-Eau-de-Cologne-3256.html,44,34,0,70
Philosykos Eau de Toilette Diptyque (unisex) ~ 1996,https://www.fragrantica.com/perfume/Diptyque/Philosykos-Eau-de-Toilette-72040.html,36,18,1996,71
Y Eau de Parfum Yves Saint Laurent (male) ~ 2018,https://www.fragrantica.com/perfume/Yves-Saint-Laurent/Y-Eau-de-Parfum-50757.html,42,30,2018,72
A'mmare Carthusia (unisex) ~ 2021,https://www.fragrantica.com/perfume/Carthusia/A-mmare-67862.html,37,21,2021,73
Luna Rossa Ocean Eau de Parfum Prada (male) ~ 2023,https://www.fragrantica.com/perfume/Prada/Luna-Rossa-Ocean-Eau-de-Parfum-81280.html,33,15,2023,74
Mandarino di Amalfi Tom Ford (unisex) ~ 2014,https://www.fragrantica.com/perfume/Tom-Ford/Mandarino-di-Amalfi-25481.html,29,11,2014,75
Legend Spirit Montblanc (male) ~ 2016,https://www.fragrantica.com/perfume/Montblanc/Legend-Spirit-33443.html,33,21,2016,76
Chance Eau Fraiche Chanel (female) ~ 2007,https://www.fragrantica.com/perfume/Chanel/Chance-Eau-Fraiche-1483.html,35,27,2007,77
Polo Deep Blue Parfum Ralph Lauren (male) ~ 2020,https://www.fragrantica.com/perfume/Ralph-Lauren/Polo-Deep-Blue-Parfum-59650.html,30,17,2020,78
Erolfa Creed (male) ~ 1992,https://www.fragrantica.com/perfume/Creed/Erolfa-4248.html,30,18,1992,79
Polo Blue Ralph Lauren (male) ~ 2003,https://www.fragrantica.com/perfume/Ralph-Lauren/Polo-Blue-1198.html,31,20,2003,80
Un Jardin Apres la Mousson Hermès (unisex) ~ 2008,https://www.fragrantica.com/perfume/Hermes/Un-Jardin-Apres-la-Mousson-2736.html,30,19,2008,81
Air di Gioia Giorgio Armani (female) ~ 2016,https://www.fragrantica.com/perfume/Giorgio-Armani/Air-di-Gioia-36599.html,35,32,2016,82
Seahorse Zoologist Perfumes (unisex) ~ 2021,https://www.fragrantica.com/perfume/Zoologist-Perfumes/Seahorse-69386.html,35,32,2021,83
On The Beach Louis Vuitton (unisex) ~ 2021,https://www.fragrantica.com/perfume/Louis-Vuitton/On-The-Beach-66060.html,32,27,2021,84
Vanilla Vibes Juliette Has A Gun (unisex) ~ 2019,https://www.fragrantica.com/perfume/Juliette-Has-A-Gun/Vanilla-Vibes-54878.html,35,33,2019,85
Costa Azzurra Acqua Tom Ford (unisex) ~ 2019,https://www.fragrantica.com/perfume/Tom-Ford/Costa-Azzurra-Acqua-52789.html,30,24,2019,86
Elysium Pour Homme Parfum Cologne Roja Dove (male) ~ 2017,https://www.fragrantica.com/perfume/Roja-Dove/Elysium-Pour-Homme-Parfum-Cologne-46296.html,24,12,2017,87
A Drop d'Issey Eau de Parfum Fraiche Issey Miyake (female) ~ 2022,https://www.fragrantica.com/perfume/Issey-Miyake/A-Drop-d-Issey-Eau-de-Parfum-Fraiche-73900.html,29,23,2022,88
Light Blue pour Homme Dolce&Gabbana (male) ~ 2007,https://www.fragrantica.com/perfume/Dolce-Gabbana/Light-Blue-pour-Homme-1068.html,29,23,2007,89
Versace Pour Femme Dylan Turquoise Versace (female) ~ 2020,https://www.fragrantica.com/perfume/Versace/Versace-Pour-Femme-Dylan-Turquoise-62966.html,31,28,2020,90
L'Eau par Kenzo Kenzo (female) ~ 1996,https://www.fragrantica.com/perfume/Kenzo/L-Eau-par-Kenzo-78.html,25,19,1996,91
Polo Blue Parfum Ralph Lauren (male) ~ 2022,https://www.fragrantica.com/perfume/Ralph-Lauren/Polo-Blue-Parfum-73299.html,24,18,2022,92
Laguna Salvador Dali (female) ~ 1991,https://www.fragrantica.com/perfume/Salvador-Dali/Laguna-768.html,26,24,1991,93
Acqua di Gio Giorgio Armani (female) ~ 1995,https://www.fragrantica.com/perfume/Giorgio-Armani/Acqua-di-Gio-411.html,31,34,1995,94
Beach Walk Maison Martin Margiela (female) ~ 2012,https://www.fragrantica.com/perfume/Maison-Martin-Margiela/Beach-Walk-15261.html,35,42,2012,95
Gaultier Divine Jean Paul Gaultier (female) ~ 2023,https://www.fragrantica.com/perfume/Jean-Paul-Gaultier/Gaultier-Divine-83889.html,41,56,2023,96
Encre Noire Sport Lalique (male) ~ 2013,https://www.fragrantica.com/perfume/Lalique/Encre-Noire-Sport-21369.html,21,16,2013,97
Lys Mediterranee Frederic Malle (unisex) ~ 2000,https://www.fragrantica.com/perfume/Frederic-Malle/Lys-Mediterranee-4640.html,23,22,2000,98
Malibu - Party in the Bay Simone Andreoli (unisex) ~ 2018,https://www.fragrantica.com/perfume/Simone-Andreoli/Malibu-Party-in-the-Bay-49244.html,19,14,2018,99
Aqua Media Cologne Forte Maison Francis Kurkdjian (unisex) ~ 2023,https://www.fragrantica.com/perfume/Maison-Francis-Kurkdjian/Aqua-Media-Cologne-Forte-82030.html,22,20,2023,100
Blanche Byredo (female) ~ 2009,https://www.fragrantica.com/perfume/Byredo/Blanche-6686.html,15,8,2009,101
Aqua Allegoria Forte Bosca Vanilla Guerlain (unisex) ~ 2023,https://www.fragrantica.com/perfume/Guerlain/Aqua-Allegoria-Forte-Bosca-Vanilla-83152.html,22,23,2023,102
Imagination Louis Vuitton (male) ~ 2021,https://www.fragrantica.com/perfume/Louis-Vuitton/Imagination-67370.html,14,7,2021,103
Legend Eau de Parfum Montblanc (male) ~ 2020,https://www.fragrantica.com/perfume/Montblanc/Legend-Eau-de-Parfum-62583.html,15,9,2020,104
Bleu de Chanel Eau de Parfum Chanel (male) ~ 2014,https://www.fragrantica.com/perfume/Chanel/Bleu-de-Chanel-Eau-de-Parfum-25967.html,11,2,2014,105
Dans Le Bleu Qui Pétille Serge Lutens (unisex) ~ 2022,https://www.fragrantica.com/perfume/Serge-Lutens/Dans-Le-Bleu-Qui-Petille-74024.html,22,25,2022,106
Aqva Divina Bvlgari (female) ~ 2015,https://www.fragrantica.com/perfume/Bvlgari/Aqva-Divina-29442.html,19,19,2015,107
Horizon Guy Laroche (male) ~ 1993,https://www.fragrantica.com/perfume/Guy-Laroche/Horizon-2070.html,14,9,1993,108
Paula's Ibiza Loewe (unisex) ~ 2020,https://www.fragrantica.com/perfume/Loewe/Paula-s-Ibiza-60646.html,12,6,2020,109
Eros Versace (male) ~ 2012,https://www.fragrantica.com/perfume/Versace/Eros-16657.html,14,10,2012,110
Every Storm a Serenade Imaginary Authors (unisex) ~ 2015,https://www.fragrantica.com/perfume/Imaginary-Authors/Every-Storm-a-Serenade-34470.html,14,11,2015,111
Aqua Universalis Forte Maison Francis Kurkdjian (unisex) ~ 2011,https://www.fragrantica.com/perfume/Maison-Francis-Kurkdjian/Aqua-Universalis-Forte-12710.html,14,12,2011,112
Acqua di Giò Profondo Lights Giorgio Armani (male) ~ 2021,https://www.fragrantica.com/perfume/Giorgio-Armani/Acqua-di-Gio-Profondo-Lights-66265.html,32,49,2021,113
Light Blue Italian Love Dolce&Gabbana (female) ~ 2022,https://www.fragrantica.com/perfume/Dolce-Gabbana/Light-Blue-Italian-Love-72621.html,18,21,2022,114
Un Matin d'Orage Eau de Parfum Goutal (female) ~ 2014,https://www.fragrantica.com/perfume/Goutal/Un-Matin-d-Orage-Eau-de-Parfum-38290.html,9,3,2014,115
Invictus Legend Paco Rabanne (male) ~ 2019,https://www.fragrantica.com/perfume/Paco-Rabanne/Invictus-Legend-54323.html,29,44,2019,116
A Drop d'Issey Issey Miyake (female) ~ 2021,https://www.fragrantica.com/perfume/Issey-Miyake/A-Drop-d-Issey-66334.html,21,28,2021,117
Rem Reminiscence (unisex) ~ 1996,https://www.fragrantica.com/perfume/Reminiscence/Rem-2260.html,16,19,1996,118
Aphrodite Soki London (female) ~ 2023,https://www.fragrantica.com/perfume/Soki-London/Aphrodite-83804.html,8,3,2023,119
Aqua Allegoria Flora Salvaggia Guerlain (female) ~ 2021,https://www.fragrantica.com/perfume/Guerlain/Aqua-Allegoria-Flora-Salvaggia-66359.html,7,1,2021,120
Bois Impérial Essential Parfums (unisex) ~ 2020,https://www.fragrantica.com/perfume/Essential-Parfums/Bois-Imperial-64338.html,10,8,2020,121
Azzaro Chrome Aqua Azzaro (male) ~ 2019,https://www.fragrantica.com/perfume/Azzaro/Azzaro-Chrome-Aqua-55454.html,10,8,2019,122
Dior Addict Dior (female) ~ 2002,https://www.fragrantica.com/perfume/Dior/Dior-Addict-215.html,11,10,2002,123
Acqua di Parma Blu Mediterraneo Arancia di Capri Acqua di Parma (unisex) ~ 1999,https://www.fragrantica.com/perfume/Acqua-di-Parma/Acqua-di-Parma-Blu-Mediterraneo-Arancia-di-Capri-1685.html,8,4,1999,124
Un Air de Bretagne L'Artisan Parfumeur (unisex) ~ 2017,https://www.fragrantica.com/perfume/L-Artisan-Parfumeur/Un-Air-de-Bretagne-45707.html,18,25,2017,125
Blue Seduction Antonio Banderas (male) ~ 2007,https://www.fragrantica.com/perfume/Antonio-Banderas/Blue-Seduction-1088.html,17,23,2007,126
Salt Ellis Brooklyn (unisex) ~ 2020,https://www.fragrantica.com/perfume/Ellis-Brooklyn/Salt-60584.html,17,23,2020,127
Coastal Cypress & Sea Fennel Eau de Parfum Molton Brown (unisex) ~ 2019,https://www.fragrantica.com/perfume/Molton-Brown/Coastal-Cypress-Sea-Fennel-Eau-de-Parfum-57720.html,12,13,2019,128
Lineage Amouage (unisex) ~ 2023,https://www.fragrantica.com/perfume/Amouage/Lineage-78654.html,13,15,2023,129
Beach Bobbi Brown (female) ~ 2009,https://www.fragrantica.com/perfume/Bobbi-Brown/Beach-10456.html,12,13,2009,130
Sous Le Pont Mirabeau Etat Libre d'Orange (unisex) ~ 2023,https://www.fragrantica.com/perfume/Etat-Libre-d-Orange/Sous-Le-Pont-Mirabeau-80360.html,7,3,2023,131
Escape for Men Calvin Klein (male) ~ 1993,https://www.fragrantica.com/perfume/Calvin-Klein/Escape-for-Men-272.html,21,32,1993,132
Rose Atlantic DS&Durga (unisex) ~ 2016,https://www.fragrantica.com/perfume/DS-Durga/Rose-Atlantic-39837.html,16,22,2016,133
Ralph Ralph Lauren (female) ~ 2000,https://www.fragrantica.com/perfume/Ralph-Lauren/Ralph-826.html,11,12,2000,134
Crimson Rocks Amouage (unisex) ~ 2020,https://www.fragrantica.com/perfume/Amouage/Crimson-Rocks-62857.html,9,8,2020,135
Luna Penhaligon's (unisex) ~ 2016,https://www.fragrantica.com/perfume/Penhaligon-s/Luna-38351.html,6,2,2016,136
Guess 1981 Indigo for Women Guess (female) ~ 2018,https://www.fragrantica.com/perfume/Guess/Guess-1981-Indigo-for-Women-48798.html,9,9,2018,137
Eau de Star Mugler (female) ~ 2007,https://www.fragrantica.com/perfume/Mugler/Eau-de-Star-1229.html,8,7,2007,138
First Instinct Abercrombie & Fitch (male) ~ 2016,https://www.fragrantica.com/perfume/Abercrombie-Fitch/First-Instinct-37753.html,8,7,2016,139
Pomelo Riviera Atelier des Ors (unisex) ~ 2019,https://www.fragrantica.com/perfume/Atelier-des-Ors/Pomelo-Riviera-54950.html,7,5,2019,140
Fleur de Peau Eau de Parfum Diptyque (unisex) ~ 2018,https://www.fragrantica.com/perfume/Diptyque/Fleur-de-Peau-Eau-de-Parfum-48681.html,7,5,2018,141
Curacao Bay Jacques Fath (unisex) ~ 2015,https://www.fragrantica.com/perfume/Jacques-Fath/Curacao-Bay-32571.html,8,7,2015,142
Ocean of a Midnight Moon Simone Andreoli (unisex) ~ 2022,https://www.fragrantica.com/perfume/Simone-Andreoli/Ocean-of-a-Midnight-Moon-73797.html,6,3,2022,143
Sea God Theodoros Kalotinis (male) ~ 2020,https://www.fragrantica.com/perfume/Theodoros-Kalotinis/Sea-God-61985.html,14,20,2020,144
Pepe Jeans Celebrate for Her Pepe Jeans London (female) ~ 2019,https://www.fragrantica.com/perfume/Pepe-Jeans-London/Pepe-Jeans-Celebrate-for-Her-57283.html,14,20,2019,145
Light Blue Summer Vibes Dolce&Gabbana (female) ~ 2023,https://www.fragrantica.com/perfume/Dolce-Gabbana/Light-Blue-Summer-Vibes-80376.html,15,22,2023,146
Alba in Asia L'Erbolario (female) ~ 2023,https://www.fragrantica.com/perfume/L-Erbolario/Alba-in-Asia-86860.html,7,6,2023,147
Armani Code Giorgio Armani (male) ~ 2004,https://www.fragrantica.com/perfume/Giorgio-Armani/Armani-Code-412.html,13,18,2004,148
Acqua di Giò Absolu Giorgio Armani (male) ~ 2018,https://www.fragrantica.com/perfume/Giorgio-Armani/Acqua-di-Gio-Absolu-48138.html,10,12,2018,149
724 Maison Francis Kurkdjian (unisex) ~ 2022,https://www.fragrantica.com/perfume/Maison-Francis-Kurkdjian/724-75754.html,10,12,2022,150
Wash Me In The Water 4160 Tuesdays (unisex) ~ 2021,https://www.fragrantica.com/perfume/4160-Tuesdays/Wash-Me-In-The-Water-71845.html,5,2,2021,151
Seemann Rammstein (unisex) ~ 2021,https://www.fragrantica.com/perfume/Rammstein/Seemann-69828.html,11,15,2021,152
Chrome Pure Azzaro (male) ~ 2017,https://www.fragrantica.com/perfume/Azzaro/Chrome-Pure-43131.html,11,15,2017,153
Hydra Figue Miller Harris (unisex) ~ 2023,https://www.fragrantica.com/perfume/Miller-Harris/Hydra-Figue-81739.html,6,5,2023,154
Light Blue Pour Homme Summer Vibes Dolce&Gabbana (male) ~ 2023,https://www.fragrantica.com/perfume/Dolce-Gabbana/Light-Blue-Pour-Homme-Summer-Vibes-80377.html,15,23,2023,155
Versace Pour Femme Dylan Blue Versace (female) ~ 2017,https://www.fragrantica.com/perfume/Versace/Versace-Pour-Femme-Dylan-Blue-47459.html,8,9,2017,156
Invictus Aqua (2018) Paco Rabanne (male) ~ 2018,https://www.fragrantica.com/perfume/Paco-Rabanne/Invictus-Aqua-2018-48760.html,6,5,2018,157
Explorer Ultra Blue Montblanc (male) ~ 2021,https://www.fragrantica.com/perfume/Montblanc/Explorer-Ultra-Blue-66266.html,23,40,2021,158
CK One Summer 2020 Calvin Klein (unisex) ~ 2020,https://www.fragrantica.com/perfume/Calvin-Klein/CK-One-Summer-2020-59549.html,14,22,2020,159
Cool Water Oceanic Edition Davidoff (female) ~ 2023,https://www.fragrantica.com/perfume/Davidoff/Cool-Water-Oceanic-Edition-84034.html,13,20,2023,160
Coastal Cypress & Sea Fennel Molton Brown (unisex) ~ 2017,https://www.fragrantica.com/perfume/Molton-Brown/Coastal-Cypress-Sea-Fennel-45197.html,9,12,2017,161
Agua Fresca Citrus Cedro Adolfo Dominguez (male) ~ 2018,https://www.fragrantica.com/perfume/Adolfo-Dominguez/Agua-Fresca-Citrus-Cedro-50145.html,7,8,2018,162
Agua de Loewe Mar de Coral Loewe (unisex) ~ 2015,https://www.fragrantica.com/perfume/Loewe/Agua-de-Loewe-Mar-de-Coral-30749.html,6,6,2015,163
Salt Rose 4160 Tuesdays (unisex) ~ 2023,https://www.fragrantica.com/perfume/4160-Tuesdays/Salt-Rose-81705.html,6,6,2023,164
Falling Into The Sea Imaginary Authors (unisex) ~ 2012,https://www.fragrantica.com/perfume/Imaginary-Authors/Falling-Into-The-Sea-16549.html,5,4,2012,165
Acqua di Parma Colonia Pura Acqua di Parma (unisex) ~ 2017,https://www.fragrantica.com/perfume/Acqua-di-Parma/Acqua-di-Parma-Colonia-Pura-45876.html,5,4,2017,166
L’Homme Cologne Bleue Yves Saint Laurent (male) ~ 2018,https://www.fragrantica.com/perfume/Yves-Saint-Laurent/L-Homme-Cologne-Bleue-48308.html,6,6,2018,167
Eau de Cartier Cartier (unisex) ~ 2001,https://www.fragrantica.com/perfume/Cartier/Eau-de-Cartier-309.html,4,2,2001,168
Uomo Salvatore Ferragamo Urban Feel Salvatore Ferragamo (male) ~ 2019,https://www.fragrantica.com/perfume/Salvatore-Ferragamo/Uomo-Salvatore-Ferragamo-Urban-Feel-55367.html,3,0,2019,169
Rem Eau de Parfum Reminiscence (female) ~ 2015,https://www.fragrantica.com/perfume/Reminiscence/Rem-Eau-de-Parfum-30789.html,3,0,2015,170
Aegean Salt & Citrus Theodoros Kalotinis (unisex) ~ 2020,https://www.fragrantica.com/perfume/Theodoros-Kalotinis/Aegean-Salt-Citrus-61984.html,16,27,2020,171
Copal Azur Aedes de Venustas (unisex) ~ 2014,https://www.fragrantica.com/perfume/Aedes-de-Venustas/Copal-Azur-28157.html,10,15,2014,172
Underwater Oasis Bath & Body Works (female) ~ 2019,https://www.fragrantica.com/perfume/Bath-Body-Works/Underwater-Oasis-53364.html,7,9,2019,173
Abyssis Les Liquides Imaginaires (unisex) ~ 2022,https://www.fragrantica.com/perfume/Les-Liquides-Imaginaires/Abyssis-73556.html,8,11,2022,174
Batucada L'Artisan Parfumeur (unisex) ~ 2011,https://www.fragrantica.com/perfume/L-Artisan-Parfumeur/Batucada-13195.html,7,9,2011,175
L'Eau d'Issey pour Homme Oceanic Expedition Issey Miyake (male) ~ 2015,https://www.fragrantica.com/perfume/Issey-Miyake/L-Eau-d-Issey-pour-Homme-Oceanic-Expedition-29684.html,5,5,2015,176
Shelter Island Bond No 9 (unisex) ~ 2014,https://www.fragrantica.com/perfume/Bond-No-9/Shelter-Island-24608.html,5,5,2014,177
English Pear & Freesia Jo Malone London (female) ~ 2010,https://www.fragrantica.com/perfume/Jo-Malone-London/English-Pear-Freesia-10314.html,8,11,2010,178
Tiffany & Co Intense Tiffany (female) ~ 2018,https://www.fragrantica.com/perfume/Tiffany/Tiffany-Co-Intense-50796.html,5,5,2018,179
Explorer Montblanc (male) ~ 2019,https://www.fragrantica.com/perfume/Montblanc/Explorer-52002.html,3,1,2019,180
Bronze Goddess 2011 Estée Lauder (female) ~ 2011,https://www.fragrantica.com/perfume/Estee-Lauder/Bronze-Goddess-2011-11538.html,8,12,2011,181
Polo Ultra Blue Ralph Lauren (male) ~ 2018,https://www.fragrantica.com/perfume/Ralph-Lauren/Polo-Ultra-Blue-48111.html,8,12,2018,182
Abyssae 33 L'Artisan Parfumeur (unisex) ~ 2022,https://www.fragrantica.com/perfume/L-Artisan-Parfumeur/Abyssae-33-75118.html,8,12,2022,183
Aqua Universalis Maison Francis Kurkdjian (unisex) ~ 2009,https://www.fragrantica.com/perfume/Maison-Francis-Kurkdjian/Aqua-Universalis-6804.html,6,8,2009,184
Aqua Sapphire Boadicea the Victorious (unisex) ~ 2021,https://www.fragrantica.com/perfume/Boadicea-the-Victorious/Aqua-Sapphire-69347.html,3,2,2021,185
Mediterranean Elizabeth Arden (female) ~ 2007,https://www.fragrantica.com/perfume/Elizabeth-Arden/Mediterranean-1607.html,3,2,2007,186
Lanvin L'Homme Lanvin (male) ~ 1997,https://www.fragrantica.com/perfume/Lanvin/Lanvin-L-Homme-6094.html,4,4,1997,187
