name,link,upvotes,downvotes,year,order
What I Did On My Holidays 4160 Tuesdays (unisex) ~ 2013,https://www.fragrantica.com/perfume/4160-Tuesdays/What-I-Did-On-My-Holidays-26401.html,4,4,2013,188
Hermessence Epice Marine Hermès (unisex) ~ 2013,https://www.fragrantica.com/perfume/Hermes/Hermessence-Epice-Marine-18851.html,3,2,2013,189
Saltburn Driftwood 4160 Tuesdays (unisex) ~ 2022,https://www.fragrantica.com/perfume/4160-Tuesdays/Saltburn-Driftwood-77570.html,3,2,2022,190
Whisky Silver Evaflor (male),https://www.fragrantica.com/perfume/Evaflor/Whisky-Silver-22284.html,2,0,0,191
Salt Air Skylar (unisex) ~ 2020,https://www.fragrantica.com/perfume/Skylar/Salt-Air-61016.html,3,2,2020,192
Colonia Club Acqua di Parma (unisex) ~ 2015,https://www.fragrantica.com/perfume/Acqua-di-Parma/Colonia-Club-31424.html,3,2,2015,193
Hamptons Bond No 9 (unisex) ~ 2005,https://www.fragrantica.com/perfume/Bond-No-9/Hamptons-3257.html,3,2,2005,194
Porthole Loumari (unisex) ~ 2022,https://www.fragrantica.com/perfume/Loumari/Porthole-83054.html,2,0,2022,195
Blu Agar Aura (unisex) ~ 2021,https://www.fragrantica.com/perfume/Agar-Aura/Blu-69495.html,2,0,2021,196
Icon Racing Alfred Dunhill (male) ~ 2017,https://www.fragrantica.com/perfume/Alfred-Dunhill/Icon-Racing-47564.html,2,0,2017,197
Sea Of Gray Solstice Scents (unisex),https://www.fragrantica.com/perfume/Solstice-Scents/Sea-Of-Gray-51256.html,2,0,0,198
Musk Therapy Initio Parfums Prives (unisex) ~ 2021,https://www.fragrantica.com/perfume/Initio-Parfums-Prives/Musk-Therapy-66097.html,3,2,2021,199
Eau de Rochas Homme Rochas (male) ~ 1993,https://www.fragrantica.com/perfume/Rochas/Eau-de-Rochas-Homme-5145.html,2,0,1993,200
Swim / SX Pierre Guillaume Paris (unisex) ~ 2019,https://www.fragrantica.com/perfume/Pierre-Guillaume-Paris/Swim-SX-54826.html,2,0,2019,201
Black Forest Al Ambra (unisex),https://www.fragrantica.com/perfume/Al-Ambra/Black-Forest-78380.html,2,0,0,202
Fiore dell'Onda L'Erbolario (female) ~ 2010,https://www.fragrantica.com/perfume/L-Erbolario/Fiore-dell-Onda-11237.html,9,15,2010,203
Unda Maris 8 Filippo Sorcinelli (unisex) ~ 2018,https://www.fragrantica.com/perfume/Filippo-Sorcinelli/Unda-Maris-8-51538.html,7,11,2018,204
Bella Tropicale Oscar de la Renta (female) ~ 2023,https://www.fragrantica.com/perfume/Oscar-de-la-Renta/Bella-Tropicale-83029.html,6,9,2023,205
Chrome Legend Azzaro (male) ~ 2007,https://www.fragrantica.com/perfume/Azzaro/Chrome-Legend-2959.html,9,15,2007,206
Levante Nobile 1942 (unisex) ~ 2017,https://www.fragrantica.com/perfume/Nobile-1942/Levante-45140.html,5,7,2017,207
Boss Bottled Pacific Hugo Boss (male) ~ 2023,https://www.fragrantica.com/perfume/Hugo-Boss/Boss-Bottled-Pacific-79762.html,10,17,2023,208
Atlante Sarah Baker Perfumes (unisex) ~ 2018,https://www.fragrantica.com/perfume/Sarah-Baker-Perfumes/Atlante-54777.html,6,9,2018,209
Jazmin Yucatan DS&Durga (unisex) ~ 2020,https://www.fragrantica.com/perfume/DS-Durga/Jazmin-Yucatan-59589.html,5,7,2020,210
Portfolio Neroli Canvas Al Haramain Perfumes (unisex) ~ 2018,https://www.fragrantica.com/perfume/Al-Haramain-Perfumes/Portfolio-Neroli-Canvas-53265.html,4,5,2018,211
Bombshell Isle Victoria's Secret (female) ~ 2023,https://www.fragrantica.com/perfume/Victoria-s-Secret/Bombshell-Isle-81954.html,5,7,2023,212
Vanille Marine Molinard (unisex) ~ 1998,https://www.fragrantica.com/perfume/Molinard/Vanille-Marine-6256.html,4,5,1998,213
Sirena Floris (female) ~ 2011,https://www.fragrantica.com/perfume/Floris/Sirena-13278.html,2,1,2011,214
Eau Mer Pekji (unisex) ~ 2015,https://www.fragrantica.com/perfume/Pekji/Eau-Mer-39823.html,2,1,2015,215
Murice Imperiale Cristian Cavagna (unisex) ~ 2022,https://www.fragrantica.com/perfume/Cristian-Cavagna/Murice-Imperiale-74759.html,2,1,2022,216
Pirate Queen 4160 Tuesdays (unisex) ~ 2023,https://www.fragrantica.com/perfume/4160-Tuesdays/Pirate-Queen-88186.html,2,1,2023,217
Sex-Sea Lorenzo Pazzaglia (unisex) ~ 2022,https://www.fragrantica.com/perfume/Lorenzo-Pazzaglia/Sex-Sea-74241.html,2,1,2022,218
Need-U Laboratorio Olfattivo (unisex) ~ 2018,https://www.fragrantica.com/perfume/Laboratorio-Olfattivo/Need-U-49298.html,2,1,2018,219
Allure Homme Edition Blanche Eau de Parfum Chanel (male) ~ 2014,https://www.fragrantica.com/perfume/Chanel/Allure-Homme-Edition-Blanche-Eau-de-Parfum-28942.html,2,1,2014,220
Ocean Dream Giorgio Beverly Hills (female) ~ 1996,https://www.fragrantica.com/perfume/Giorgio-Beverly-Hills/Ocean-Dream-1892.html,9,16,1996,221
Oceani di Seta Salvatore Ferragamo (unisex) ~ 2021,https://www.fragrantica.com/perfume/Salvatore-Ferragamo/Oceani-di-Seta-66365.html,6,10,2021,222
Fantasia Mermaid Anna Sui (female) ~ 2019,https://www.fragrantica.com/perfume/Anna-Sui/Fantasia-Mermaid-54060.html,7,12,2019,223
Aqua Kenzo pour Femme Kenzo (female) ~ 2018,https://www.fragrantica.com/perfume/Kenzo/Aqua-Kenzo-pour-Femme-49289.html,4,6,2018,224
Sydney Rock Pool Arquiste (unisex) ~ 2018,https://www.fragrantica.com/perfume/Arquiste/Sydney-Rock-Pool-53078.html,4,6,2018,225
Rem Coco Reminiscence (female) ~ 2020,https://www.fragrantica.com/perfume/Reminiscence/Rem-Coco-61203.html,4,6,2020,226
Aqua Celestia Maison Francis Kurkdjian (unisex) ~ 2017,https://www.fragrantica.com/perfume/Maison-Francis-Kurkdjian/Aqua-Celestia-42268.html,5,8,2017,227
Soleil Vibrant Lalique (female) ~ 2022,https://www.fragrantica.com/perfume/Lalique/Soleil-Vibrant-72448.html,4,6,2022,228
Nautica Voyage N-83 Nautica (male) ~ 2013,https://www.fragrantica.com/perfume/Nautica/Nautica-Voyage-N-83-23097.html,5,8,2013,229
Acqua Jeanne en Provence (male) ~ 2015,https://www.fragrantica.com/perfume/Jeanne-en-Provence/Acqua-30808.html,3,4,2015,230
"801 sea spray, cedar, grapefruit Bon Parfumeur (unisex) ~ 2017",https://www.fragrantica.com/perfume/Bon-Parfumeur/801-sea-spray-cedar-grapefruit-51012.html,3,4,2017,231
Ocean for Men Bath & Body Works (male),https://www.fragrantica.com/perfume/Bath-Body-Works/Ocean-for-Men-10047.html,3,4,0,232
Sel d'Argent BDK Parfums (unisex) ~ 2020,https://www.fragrantica.com/perfume/BDK-Parfums/Sel-d-Argent-61926.html,3,4,2020,233
Mefisto Xerjoff (male) ~ 2009,https://www.fragrantica.com/perfume/Xerjoff/Mefisto-6310.html,4,6,2009,234
Oceanic Amber Korres (male) ~ 2021,https://www.fragrantica.com/perfume/Korres/Oceanic-Amber-67504.html,2,2,2021,235
Cote d’Amour L'Artisan Parfumeur (unisex) ~ 2009,https://www.fragrantica.com/perfume/L-Artisan-Parfumeur/Cote-d-Amour-5963.html,3,4,2009,236
Moscow Mule Juliette Has A Gun (unisex) ~ 2017,https://www.fragrantica.com/perfume/Juliette-Has-A-Gun/Moscow-Mule-47872.html,2,2,2017,237
Paula's Ibiza Eclectic Loewe (unisex) ~ 2022,https://www.fragrantica.com/perfume/Loewe/Paula-s-Ibiza-Eclectic-73103.html,2,2,2022,238
CK One Reflections Calvin Klein (unisex) ~ 2023,https://www.fragrantica.com/perfume/Calvin-Klein/CK-One-Reflections-79608.html,2,2,2023,239
Blue Agave Precious Liquid (unisex) ~ 2017,https://www.fragrantica.com/perfume/Precious-Liquid/Blue-Agave-46155.html,1,0,2017,240
Salt & Pepper Precious Liquid (unisex) ~ 2022,https://www.fragrantica.com/perfume/Precious-Liquid/Salt-Pepper-80626.html,1,0,2022,241
Jake's House Henry Rose (unisex) ~ 2019,https://www.fragrantica.com/perfume/Henry-Rose/Jake-s-House-54618.html,1,0,2019,242
Salaria Giardino Benessere (unisex) ~ 2017,https://www.fragrantica.com/perfume/Giardino-Benessere/Salaria-46651.html,1,0,2017,243
Musc Palawan Lorga Parfums (unisex) ~ 2019,https://www.fragrantica.com/perfume/Lorga-Parfums/Musc-Palawan-61403.html,1,0,2019,244
Couleur Vanille L'Artisan Parfumeur (unisex) ~ 2020,https://www.fragrantica.com/perfume/L-Artisan-Parfumeur/Couleur-Vanille-59343.html,1,0,2020,245
Apple Brandy on the Rocks By Kilian (unisex) ~ 2021,https://www.fragrantica.com/perfume/By-Kilian/Apple-Brandy-on-the-Rocks-68326.html,2,2,2021,246
Nuevalos nBitor (unisex) ~ 2023,https://www.fragrantica.com/perfume/nBitor/Nuevalos-80718.html,1,0,2023,247
Armani Prive Rouge Malachite Giorgio Armani (unisex) ~ 2016,https://www.fragrantica.com/perfume/Giorgio-Armani/Armani-Prive-Rouge-Malachite-34589.html,1,0,2016,248
Amongst Waves Gallagher Fragrances (unisex) ~ 2017,https://www.fragrantica.com/perfume/Gallagher-Fragrances/Amongst-Waves-45097.html,1,0,2017,249
Azure Lime Tom Ford (unisex) ~ 2010,https://www.fragrantica.com/perfume/Tom-Ford/Azure-Lime-8706.html,1,0,2010,250
Boss Bottled Marine Hugo Boss (male) ~ 2022,https://www.fragrantica.com/perfume/Hugo-Boss/Boss-Bottled-Marine-72259.html,1,0,2022,251
Tempesta di Mare Extrait de Parfum Maiora Parfum (unisex) ~ 2022,https://www.fragrantica.com/perfume/Maiora-Parfum/Tempesta-di-Mare-Extrait-de-Parfum-75398.html,1,0,2022,252
Winter Sky Victoria's Secret (female) ~ 2020,https://www.fragrantica.com/perfume/Victoria-s-Secret/Winter-Sky-65023.html,1,0,2020,253
Wild Ocean Courrèges (male) ~ 2019,https://www.fragrantica.com/perfume/Courreges/Wild-Ocean-53952.html,1,0,2019,254
Salina Laboratorio Olfattivo (unisex) ~ 2013,https://www.fragrantica.com/perfume/Laboratorio-Olfattivo/Salina-18615.html,1,0,2013,255
Acqua di Gio Profumo Special Blend Giorgio Armani (male) ~ 2017,https://www.fragrantica.com/perfume/Giorgio-Armani/Acqua-di-Gio-Profumo-Special-Blend-46467.html,13,25,2017,256
A Drop d'Issey Essentielle Issey Miyake (female) ~ 2023,https://www.fragrantica.com/perfume/Issey-Miyake/A-Drop-d-Issey-Essentielle-81420.html,10,19,2023,257
Aqua Motu Eau de Toilette Comptoir Sud Pacifique (unisex) ~ 1993,https://www.fragrantica.com/perfume/Comptoir-Sud-Pacifique/Aqua-Motu-Eau-de-Toilette-751.html,4,7,1993,258
Riviera Drive Atelier des Ors (unisex) ~ 2019,https://www.fragrantica.com/perfume/Atelier-des-Ors/Riviera-Drive-54949.html,7,13,2019,259
Salty Ocean Bouquet Zara (female) ~ 2022,https://www.fragrantica.com/perfume/Zara/Salty-Ocean-Bouquet-75204.html,6,11,2022,260
Roberto Cavalli Acqua Roberto Cavalli (female) ~ 2013,https://www.fragrantica.com/perfume/Roberto-Cavalli/Roberto-Cavalli-Acqua-17310.html,5,9,2013,261
Crossmen Original Coty (male) ~ 1989,https://www.fragrantica.com/perfume/Coty/Crossmen-Original-36503.html,4,7,1989,262
Aqua Vitae Forte Maison Francis Kurkdjian (unisex) ~ 2015,https://www.fragrantica.com/perfume/Maison-Francis-Kurkdjian/Aqua-Vitae-Forte-31404.html,4,7,2015,263
Détour Noir Al Haramain Perfumes (unisex) ~ 2021,https://www.fragrantica.com/perfume/Al-Haramain-Perfumes/Detour-Noir-70748.html,11,21,2021,264
A*Men Pure Shot Mugler (male) ~ 2012,https://www.fragrantica.com/perfume/Mugler/A-Men-Pure-Shot-14522.html,4,7,2012,265
Boss Bottled Infinite Hugo Boss (male) ~ 2019,https://www.fragrantica.com/perfume/Hugo-Boss/Boss-Bottled-Infinite-54204.html,5,9,2019,266
Azzaro Chrome Parfum Azzaro (male) ~ 2023,https://www.fragrantica.com/perfume/Azzaro/Azzaro-Chrome-Parfum-79268.html,6,11,2023,267
L'Eau De Monteil Germaine Monteil (female) ~ 1995,https://www.fragrantica.com/perfume/Germaine-Monteil/L-Eau-De-Monteil-4934.html,2,3,1995,268
Azzaro Pour Homme Summer Edition 2013 Azzaro (male) ~ 2013,https://www.fragrantica.com/perfume/Azzaro/Azzaro-Pour-Homme-Summer-Edition-2013-17863.html,1,1,2013,269
LA MAR House of BŌ (unisex) ~ 2021,https://www.fragrantica.com/perfume/House-of-BO/LA-MAR-69822.html,2,3,2021,270
Regina Moresque (unisex) ~ 2016,https://www.fragrantica.com/perfume/Moresque/Regina-41028.html,1,1,2016,271
Lily Floris (female) ~ 2023,https://www.fragrantica.com/perfume/Floris/Lily-81635.html,1,1,2023,272
Eternity Aqua for Men Calvin Klein (male) ~ 2010,https://www.fragrantica.com/perfume/Calvin-Klein/Eternity-Aqua-for-Men-8098.html,3,5,2010,273
French Riviera Mancera (unisex) ~ 2022,https://www.fragrantica.com/perfume/Mancera/French-Riviera-74636.html,3,5,2022,274
Deep Water Claudio Zucca Parfums (unisex) ~ 2022,https://www.fragrantica.com/perfume/Claudio-Zucca-Parfums/Deep-Water-75132.html,1,1,2022,275
Liam Blue Shine Lattafa Perfumes (unisex) ~ 2023,https://www.fragrantica.com/perfume/Lattafa-Perfumes/Liam-Blue-Shine-85096.html,1,1,2023,276
Sea Foam Art de Parfum (unisex) ~ 2016,https://www.fragrantica.com/perfume/Art-de-Parfum/Sea-Foam-39432.html,1,1,2016,277
Lemon Line Mancera (unisex) ~ 2014,https://www.fragrantica.com/perfume/Mancera/Lemon-Line-24774.html,1,1,2014,278
Aquarose Gallagher Fragrances (unisex) ~ 2021,https://www.fragrantica.com/perfume/Gallagher-Fragrances/Aquarose-68362.html,1,1,2021,279
Zeitgeist J.F. Schwarzlose Berlin (unisex) ~ 2012,https://www.fragrantica.com/perfume/J-F-Schwarzlose-Berlin/Zeitgeist-24282.html,1,1,2012,280
Escape Calvin Klein (female) ~ 1991,https://www.fragrantica.com/perfume/Calvin-Klein/Escape-271.html,2,3,1991,281
Boss Woman Hugo Boss (female) ~ 2000,https://www.fragrantica.com/perfume/Hugo-Boss/Boss-Woman-381.html,1,1,2000,282
Marfa Spices Memo Paris (unisex) ~ 2018,https://www.fragrantica.com/perfume/Memo-Paris/Marfa-Spices-48077.html,1,1,2018,283
Yacht Mood Arabian Oud (male) ~ 2023,https://www.fragrantica.com/perfume/Arabian-Oud/Yacht-Mood-85161.html,1,1,2023,284
Voyageur Jean Patou (male) ~ 1995,https://www.fragrantica.com/perfume/Jean-Patou/Voyageur-2281.html,1,1,1995,285
Light Blue Sun Pour Homme Dolce&Gabbana (male) ~ 2019,https://www.fragrantica.com/perfume/Dolce-Gabbana/Light-Blue-Sun-Pour-Homme-54494.html,1,1,2019,286
Luna Rossa Ocean Prada (male) ~ 2021,https://www.fragrantica.com/perfume/Prada/Luna-Rossa-Ocean-68753.html,1,1,2021,287
Thalasso Therapy Tesori d'Oriente (unisex) ~ 2020,https://www.fragrantica.com/perfume/Tesori-d-Oriente/Thalasso-Therapy-62102.html,10,20,2020,288
Linen Rose Eau de Cologne Aerin Lauder (female) ~ 2017,https://www.fragrantica.com/perfume/Aerin-Lauder/Linen-Rose-Eau-de-Cologne-43329.html,4,8,2017,289
Firewater Jorum Studio (unisex) ~ 2022,https://www.fragrantica.com/perfume/Jorum-Studio/Firewater-73895.html,3,6,2022,290
Banho Refrescante Marina Avatim (unisex) ~ 2018,https://www.fragrantica.com/perfume/Avatim/Banho-Refrescante-Marina-61879.html,2,4,2018,291
Queen Of The Sea New Notes (unisex) ~ 2022,https://www.fragrantica.com/perfume/New-Notes/Queen-Of-The-Sea-72446.html,2,4,2022,292
Oceanus The Body Shop (unisex),https://www.fragrantica.com/perfume/The-Body-Shop/Oceanus-3335.html,2,4,0,293
Peony & Blush Suede Jo Malone London (female) ~ 2013,https://www.fragrantica.com/perfume/Jo-Malone-London/Peony-Blush-Suede-18767.html,4,8,2013,294
CK IN2U for Him Calvin Klein (male) ~ 2007,https://www.fragrantica.com/perfume/Calvin-Klein/CK-IN2U-for-Him-933.html,4,8,2007,295
Cool Water Aquaman Collector Davidoff (male) ~ 2020,https://www.fragrantica.com/perfume/Davidoff/Cool-Water-Aquaman-Collector-60889.html,2,4,2020,296
Kyma Korres (unisex) ~ 2022,https://www.fragrantica.com/perfume/Korres/Kyma-75509.html,1,2,2022,297
Avgoustos Korres (unisex) ~ 2022,https://www.fragrantica.com/perfume/Korres/Avgoustos-75507.html,1,2,2022,298
Yaringa Parfums d'Elmar (unisex) ~ 2022,https://www.fragrantica.com/perfume/Parfums-d-Elmar/Yaringa-79221.html,1,2,2022,299
Dirty Lush (unisex),https://www.fragrantica.com/perfume/Lush/Dirty-62545.html,1,2,0,300
Moschino Funny! Moschino (female) ~ 2007,https://www.fragrantica.com/perfume/Moschino/Moschino-Funny-1215.html,0,0,2007,301
Oltremare Bois 1920 (unisex) ~ 2011,https://www.fragrantica.com/perfume/Bois-1920/Oltremare-13187.html,10,21,2011,302
Acqua di Scandola Parfum d'Empire (unisex) ~ 2018,https://www.fragrantica.com/perfume/Parfum-d-Empire/Acqua-di-Scandola-52166.html,7,15,2018,303
Shine Azzaro (unisex) ~ 2019,https://www.fragrantica.com/perfume/Azzaro/Shine-54972.html,3,7,2019,304
Sailors The Zoo (male) ~ 2018,https://www.fragrantica.com/perfume/The-Zoo/Sailors-51367.html,3,7,2018,305
Del Mar Day Three (unisex) ~ 2023,https://www.fragrantica.com/perfume/Day-Three/Del-Mar-82921.html,3,7,2023,306
Crab Apple Blossom Clive Christian (unisex) ~ 2020,https://www.fragrantica.com/perfume/Clive-Christian/Crab-Apple-Blossom-63461.html,4,9,2020,307
Sur La Plage Veronique Gabai (unisex) ~ 2019,https://www.fragrantica.com/perfume/Veronique-Gabai/Sur-La-Plage-60674.html,3,7,2019,308
Kaiak Aero Natura (female) ~ 2018,https://www.fragrantica.com/perfume/Natura/Kaiak-Aero-52025.html,3,7,2018,309
Soft Laundry Clean (female) ~ 2022,https://www.fragrantica.com/perfume/Clean/Soft-Laundry-75629.html,3,7,2022,310
Nabati Astrophil & Stella (unisex) ~ 2021,https://www.fragrantica.com/perfume/Astrophil-Stella/Nabati-69515.html,2,5,2021,311
Overdose Omanluxury (unisex) ~ 2020,https://www.fragrantica.com/perfume/Omanluxury/Overdose-51552.html,2,5,2020,312
L'Homme Sport Lanvin (male) ~ 2009,https://www.fragrantica.com/perfume/Lanvin/L-Homme-Sport-5717.html,1,3,2009,313
Gardenia Rattan Aerin Lauder (female) ~ 2013,https://www.fragrantica.com/perfume/Aerin-Lauder/Gardenia-Rattan-19055.html,8,18,2013,314
Solstice Andrea Maack (unisex) ~ 2023,https://www.fragrantica.com/perfume/Andrea-Maack/Solstice-82354.html,6,14,2023,315
Rise Akro (unisex) ~ 2023,https://www.fragrantica.com/perfume/Akro/Rise-84247.html,5,12,2023,316
Karst Aesop (unisex) ~ 2021,https://www.fragrantica.com/perfume/Aesop/Karst-69187.html,4,10,2021,317
Nautica Nautica (male) ~ 1992,https://www.fragrantica.com/perfume/Nautica/Nautica-2479.html,5,12,1992,318
Sel Océan Le Monde Gourmand (female) ~ 2016,https://www.fragrantica.com/perfume/Le-Monde-Gourmand/Sel-Ocean-43571.html,2,6,2016,319
Parisian Musc Matiere Premiere (unisex) ~ 2019,https://www.fragrantica.com/perfume/Matiere-Premiere/Parisian-Musc-59063.html,2,6,2019,320
Tales from Zanzibar Memoirs Of A Perfume Collector (unisex) ~ 2021,https://www.fragrantica.com/perfume/Memoirs-Of-A-Perfume-Collector/Tales-from-Zanzibar-72008.html,1,4,2021,321
Alõ Carrement Belle (unisex) ~ 2018,https://www.fragrantica.com/perfume/Carrement-Belle/Alo-82144.html,1,4,2018,322
Myrrh & Tonka Jo Malone London (unisex) ~ 2016,https://www.fragrantica.com/perfume/Jo-Malone-London/Myrrh-Tonka-42027.html,2,6,2016,323
Aqua Sextius Jul et Mad Paris (unisex) ~ 2014,https://www.fragrantica.com/perfume/Jul-et-Mad-Paris/Aqua-Sextius-24626.html,8,19,2014,324
Wave Musk Mancera (unisex) ~ 2011,https://www.fragrantica.com/perfume/Mancera/Wave-Musk-15207.html,9,21,2011,325
M Mariah Carey (female) ~ 2007,https://www.fragrantica.com/perfume/Mariah-Carey/M-1151.html,10,23,2007,326
Kaiak Oceano Natura (male) ~ 2020,https://www.fragrantica.com/perfume/Natura/Kaiak-Oceano-63020.html,4,11,2020,327
Reveal Men Calvin Klein (male) ~ 2015,https://www.fragrantica.com/perfume/Calvin-Klein/Reveal-Men-27996.html,8,19,2015,328
Elise Rance 1795 (female) ~ 2012,https://www.fragrantica.com/perfume/Rance-1795/Elise-16886.html,3,9,2012,329
Silence The Sea Strangelove NYC (unisex) ~ 2016,https://www.fragrantica.com/perfume/Strangelove-NYC/Silence-The-Sea-43189.html,6,16,2016,330
Classic Newport Caswell Massey (male) ~ 2017,https://www.fragrantica.com/perfume/Caswell-Massey/Classic-Newport-50087.html,2,8,2017,331
Sail Acqua di Portofino (unisex) ~ 2012,https://www.fragrantica.com/perfume/Acqua-di-Portofino/Sail-17036.html,2,8,2012,332
Chaos Vertus (unisex) ~ 2021,https://www.fragrantica.com/perfume/Vertus/Chaos-69904.html,7,19,2021,333
Wet Stone Amouroud (unisex) ~ 2019,https://www.fragrantica.com/perfume/Amouroud/Wet-Stone-54986.html,7,19,2019,334
Sirenis Les Liquides Imaginaires (unisex) ~ 2022,https://www.fragrantica.com/perfume/Les-Liquides-Imaginaires/Sirenis-73554.html,6,17,2022,335
Sunset Heat for Men Escada (male) ~ 2007,https://www.fragrantica.com/perfume/Escada/Sunset-Heat-for-Men-836.html,2,9,2007,336
Baccarat Rouge 540 Maison Francis Kurkdjian (unisex) ~ 2015,https://www.fragrantica.com/perfume/Maison-Francis-Kurkdjian/Baccarat-Rouge-540-33519.html,14,33,2015,337
Aquatic Ozonic Anomalia Paris (unisex) ~ 2022,https://www.fragrantica.com/perfume/Anomalia-Paris/Aquatic-Ozonic-77617.html,5,16,2022,338
Kaiak Aero Natura (male) ~ 2018,https://www.fragrantica.com/perfume/Natura/Kaiak-Aero-48944.html,3,12,2018,339
Kaiak O2 Natura (male) ~ 2023,https://www.fragrantica.com/perfume/Natura/Kaiak-O2-87211.html,4,14,2023,340
Cocktails & Catamarans Scent Journey (unisex) ~ 2022,https://www.fragrantica.com/perfume/Scent-Journey/Cocktails-Catamarans-75623.html,2,10,2022,341
Escada Moon Sparkle pour Homme Escada (male) ~ 2007,https://www.fragrantica.com/perfume/Escada/Escada-Moon-Sparkle-pour-Homme-2208.html,2,10,2007,342
Kind Intentions Navitus Parfums (unisex) ~ 2023,https://www.fragrantica.com/perfume/Navitus-Parfums/Kind-Intentions-83622.html,6,19,2023,343
Greek Keys Sarah Baker Perfumes (unisex) ~ 2016,https://www.fragrantica.com/perfume/Sarah-Baker-Perfumes/Greek-Keys-47485.html,1,9,2016,344
Kaiak Oceano Natura (female) ~ 2021,https://www.fragrantica.com/perfume/Natura/Kaiak-Oceano-64961.html,3,14,2021,345
Lust for Sun Juliette Has A Gun (unisex) ~ 2023,https://www.fragrantica.com/perfume/Juliette-Has-A-Gun/Lust-for-Sun-80004.html,1,10,2023,346
La Vie Est Belle Soleil Cristal Lancôme (female) ~ 2021,https://www.fragrantica.com/perfume/Lancome/La-Vie-Est-Belle-Soleil-Cristal-65156.html,4,16,2021,347
Brazilian Crush Cheirosa '68 Sol de Janeiro (female) ~ 2022,https://www.fragrantica.com/perfume/Sol-de-Janeiro/Brazilian-Crush-Cheirosa-68-73990.html,18,45,2022,348
Sandflowers Montale (unisex) ~ 2009,https://www.fragrantica.com/perfume/Montale/Sandflowers-3766.html,7,24,2009,349
Oceanic Symphony Sphinx Fragrances (unisex) ~ 2023,https://www.fragrantica.com/perfume/Sphinx-Fragrances/Oceanic-Symphony-87963.html,4,18,2023,350
Narco Oasis Narcotica (unisex) ~ 2023,https://www.fragrantica.com/perfume/Narcotica/Narco-Oasis-84576.html,5,20,2023,351
Ocean Noir Michael Malul London (male) ~ 2021,https://www.fragrantica.com/perfume/Michael-Malul-London/Ocean-Noir-70722.html,3,16,2021,352
Musc K Ella K Parfums (unisex) ~ 2023,https://www.fragrantica.com/perfume/Ella-K-Parfums/Musc-K-84119.html,7,25,2023,353
Sal Y Limon Carner Barcelona (unisex) ~ 2022,https://www.fragrantica.com/perfume/Carner-Barcelona/Sal-Y-Limon-74478.html,3,18,2022,354
Acqua di Gioia Essenza Giorgio Armani (female) ~ 2011,https://www.fragrantica.com/perfume/Giorgio-Armani/Acqua-di-Gioia-Essenza-12402.html,2,17,2011,355
Surfing Puerto Escondido Zara (male) ~ 2023,https://www.fragrantica.com/perfume/Zara/Surfing-Puerto-Escondido-80489.html,1,17,2023,356
Le Joker Art de Parfum (unisex) ~ 2020,https://www.fragrantica.com/perfume/Art-de-Parfum/Le-Joker-61908.html,2,20,2020,357
R.E.M. Ariana Grande (female) ~ 2020,https://www.fragrantica.com/perfume/Ariana-Grande/R-E-M-62578.html,7,31,2020,358
