https://www.fragrantica.com/perfume/Jean-Paul-Gaultier/Le-Male-Popeye-Eau-Fraiche-36636.html,,,,,,Le Male Popeye Eau Fraiche Jean Paul Gaultier (male) ~ 2016,9.0,16.0,2016.0,458.0,Le Male Popeye Eau Fraiche Jean Paul Gaultier (male) ~ 2016,10.0,7.0,2016.0,336.0,Le Male Popeye Eau Fraiche Jean Paul Gaultier (male) ~ 2016,27.0,45.0,2016.0,462.0,,,,,,Le Male Popeye Eau Fraiche Jean Paul Gaultier (male) ~ 2016,6.0,8.0,2016.0,654.0,,,,True
https://www.fragrantica.com/perfume/Acqua-di-Parma/Cedro-di-Taormina-35398.html,,,,,,Cedro di Taormina Acqua di Parma (unisex) ~ 2016,5.0,8.0,2016.0,459.0,,,,,,,,,,,,,,,,,,,,,,,,True
https://www.fragrantica.com/perfume/Frederic-Malle/Music-For-a-While-47795.html,,,,,,Music For a While Frederic Malle (unisex) ~ 2018,6.0,10.0,2018.0,461.0,Music For a While Frederic Malle (unisex) ~ 2018,2.0,5.0,2018.0,595.0,Music For a While Frederic Malle (unisex) ~ 2018,25.0,36.0,2018.0,413.0,Music For a While Frederic Malle (unisex) ~ 2018,13.0,22.0,2018.0,627.0,Music For a While Frederic Malle (unisex) ~ 2018,9.0,24.0,2018.0,978.0,,,,True
https://www.fragrantica.com/perfume/Carven/Monsieur-Carven-3469.html,,,,,,Monsieur Carven Carven (male) ~ 1978,4.0,6.0,1978.0,462.0,,,,,,,,,,,,,,,,,,,,,,,,True
https://www.fragrantica.com/perfume/Jacques-Bogart/Club-75-VIP-51936.html,,,,,,Club 75 VIP Jacques Bogart (male) ~ 2018,5.0,8.0,2018.0,465.0,,,,,,,,,,,,,,,,,,,,,,,,True
https://www.fragrantica.com/perfume/Jo-Malone-London/Oud-Bergamot-12928.html,,,,,,Oud & Bergamot Jo Malone London (unisex) ~ 2010,5.0,8.0,2010.0,466.0,Oud & Bergamot Jo Malone London (unisex) ~ 2010,22.0,17.0,2010.0,221.0,,,,,,,,,,,Oud & Bergamot Jo Malone London (unisex) ~ 2010,16.0,26.0,2010.0,614.0,,,,True
https://www.fragrantica.com/perfume/Hugo-Boss/Boss-The-Scent-Intense-44512.html,,,,,,Boss The Scent Intense Hugo Boss (male) ~ 2017,5.0,8.0,2017.0,467.0,,,,,,Boss The Scent Intense Hugo Boss (male) ~ 2017,1.0,2.0,2017.0,713.0,,,,,,,,,,,,,,True
https://www.fragrantica.com/perfume/Amouage/Asrar-13483.html,,,,,,Asrar Amouage (unisex),3.0,4.0,0.0,470.0,,,,,,,,,,,,,,,,,,,,,,,,True
https://www.fragrantica.com/perfume/James-Heeley/Cardinal-7844.html,,,,,,Cardinal James Heeley (unisex),3.0,4.0,0.0,471.0,,,,,,Cardinal James Heeley (unisex),2.0,0.0,0.0,548.0,,,,,,,,,,,,,,True
https://www.fragrantica.com/perfume/James-Heeley/Menthe-Fraiche-7851.html,,,,,,Menthe Fraiche James Heeley (unisex) ~ 2006,2.0,2.0,2006.0,472.0,,,,,,,,,,,,,,,,,,,,,,,,True
https://www.fragrantica.com/perfume/Charriol/Royal-Leather-15264.html,,,,,,Royal Leather Charriol (male) ~ 2012,2.0,2.0,2012.0,475.0,,,,,,,,,,,,,,,,,,,,,,,,True
https://www.fragrantica.com/perfume/Slumberhouse/Kiste-31278.html,,,,,,Kiste Slumberhouse (unisex) ~ 2015,8.0,15.0,2015.0,480.0,,,,,,,,,,,Kiste Slumberhouse (unisex) ~ 2015,4.0,9.0,2015.0,889.0,Kiste Slumberhouse (unisex) ~ 2015,10.0,21.0,2015.0,796.0,,,,True
https://www.fragrantica.com/perfume/Ormonde-Jayne/Osmanthus-4923.html,,,,,,Osmanthus Ormonde Jayne (unisex) ~ 2006,6.0,11.0,2006.0,481.0,,,,,,,,,,,,,,,,,,,,,,,,True
https://www.fragrantica.com/perfume/Giorgio-Armani/Acqua-di-Gio-Absolu-48138.html,,,,,,Acqua di Giò Absolu Giorgio Armani (male) ~ 2018,15.0,29.0,2018.0,482.0,,,,,,Acqua di Giò Absolu Giorgio Armani (male) ~ 2018,11.0,17.0,2018.0,527.0,,,,,,Acqua di Giò Absolu Giorgio Armani (male) ~ 2018,33.0,30.0,2018.0,363.0,,,,True
https://www.fragrantica.com/perfume/Ermenegildo-Zegna/Zegna-Intenso-947.html,,,,,,Zegna Intenso Ermenegildo Zegna (male) ~ 2007,7.0,13.0,2007.0,483.0,,,,,,,,,,,,,,,,,,,,,,,,True
https://www.fragrantica.com/perfume/Hanae-Mori/HiM-16099.html,,,,,,HiM Hanae Mori (male) ~ 2012,9.0,17.0,2012.0,485.0,,,,,,,,,,,HiM Hanae Mori (male) ~ 2012,3.0,2.0,2012.0,653.0,,,,,,,,,True
https://www.fragrantica.com/perfume/Maison-Francis-Kurkdjian/APOM-Pour-Homme-6806.html,,,,,,APOM Pour Homme Maison Francis Kurkdjian (male) ~ 2009,5.0,9.0,2009.0,486.0,,,,,,,,,,,APOM Pour Homme Maison Francis Kurkdjian (male) ~ 2009,12.0,21.0,2009.0,672.0,APOM Pour Homme Maison Francis Kurkdjian (male) ~ 2009,3.0,3.0,2009.0,688.0,,,,True
https://www.fragrantica.com/perfume/Karl-Lagerfeld/Lagerfeld-Men-1312.html,,,,,,Lagerfeld Men Karl Lagerfeld (male) ~ 2003,5.0,9.0,2003.0,489.0,,,,,,,,,,,,,,,,,,,,,,,,True
https://www.fragrantica.com/perfume/Kenneth-Cole/Signature-2969.html,,,,,,Signature Kenneth Cole (male) ~ 2005,4.0,7.0,2005.0,490.0,,,,,,,,,,,,,,,,,,,,,,,,True
https://www.fragrantica.com/perfume/Atelier-Cologne/Tobacco-Nuit-35381.html,,,,,,Tobacco Nuit Atelier Cologne (unisex) ~ 2016,5.0,9.0,2016.0,491.0,,,,,,,,,,,,,,,,,,,,,,,,True
https://www.fragrantica.com/perfume/Sultan-Pasha-Attars/Tabac-Grande-43238.html,,,,,,Tabac Grande Sultan Pasha Attars (unisex) ~ 2016,2.0,3.0,2016.0,493.0,Tabac Grande Sultan Pasha Attars (unisex) ~ 2016,3.0,1.0,2016.0,433.0,,,,,,,,,,,,,,,,,,,True
https://www.fragrantica.com/perfume/Kelsey-Berwin/Zeus-49793.html,,,,,,Zeus Kelsey Berwin (male) ~ 2014,1.0,1.0,2014.0,495.0,Zeus Kelsey Berwin (male) ~ 2014,1.0,3.0,2014.0,604.0,,,,,,,,,,,,,,,,,,,True
https://www.fragrantica.com/perfume/Escada/Escada-Sentiment-pour-Homme-1180.html,,,,,,Escada Sentiment pour Homme Escada (male) ~ 2002,1.0,1.0,2002.0,496.0,,,,,,,,,,,,,,,,,,,,,,,,True
https://www.fragrantica.com/perfume/Remy-Latour/Cigar-9351.html,,,,,,Cigar Remy Latour (male) ~ 1996,1.0,1.0,1996.0,498.0,,,,,,,,,,,,,,,,,,,,,,,,True
https://www.fragrantica.com/perfume/Pierre-Balmain/Balmain-Homme-31089.html,,,,,,Balmain Homme Pierre Balmain (male) ~ 2015,1.0,1.0,2015.0,499.0,,,,,,,,,,,,,,,,Balmain Homme Pierre Balmain (male) ~ 2015,1.0,4.0,2015.0,886.0,,,,True
https://www.fragrantica.com/perfume/Giorgio-Armani/Armani-Code-Ultimate-15718.html,,,,,,Armani Code Ultimate Giorgio Armani (male) ~ 2012,1.0,1.0,2012.0,502.0,,,,,,Armani Code Ultimate Giorgio Armani (male) ~ 2012,7.0,15.0,2012.0,719.0,Armani Code Ultimate Giorgio Armani (male) ~ 2012,5.0,8.0,2012.0,735.0,,,,,,,,,True
https://www.fragrantica.com/perfume/V-Canto/Arsenico-44257.html,,,,,,Arsenico V Canto (unisex) ~ 2017,1.0,1.0,2017.0,503.0,,,,,,,,,,,Arsenico V Canto (unisex) ~ 2017,2.0,8.0,2017.0,1001.0,,,,,,,,,True
https://www.fragrantica.com/perfume/Fort-Manle/Fatih-Sultan-Mehmed-44853.html,,,,,,Fatih Sultan Mehmed Fort & Manle (unisex) ~ 2016,1.0,1.0,2016.0,504.0,,,,,,,,,,,,,,,,,,,,,,,,True
https://www.fragrantica.com/perfume/Parfums-de-Marly/Layton-Exclusif-46633.html,,,,,,Layton Exclusif Parfums de Marly (unisex) ~ 2017,1.0,1.0,2017.0,505.0,,,,,,,,,,,Layton Exclusif Parfums de Marly (unisex) ~ 2017,100.0,58.0,2017.0,142.0,Layton Exclusif Parfums de Marly (unisex) ~ 2017,189.0,129.0,2017.0,99.0,,,,True
https://www.fragrantica.com/perfume/Sean-John/Unforgivable-2209.html,,,,,,Unforgivable Sean John (male) ~ 2006,9.0,18.0,2006.0,506.0,,,,,,Unforgivable Sean John (male) ~ 2006,1.0,3.0,2006.0,750.0,,,,,,Unforgivable Sean John (male) ~ 2006,5.0,9.0,2006.0,743.0,,,,True
https://www.fragrantica.com/perfume/Dolce-Gabbana/The-One-Grey-50611.html,,,,,,The One Grey Dolce&Gabbana (male) ~ 2018,13.0,26.0,2018.0,507.0,,,,,,,,,,,The One Grey Dolce&Gabbana (male) ~ 2018,4.0,4.0,2018.0,652.0,The One Grey Dolce&Gabbana (male) ~ 2018,17.0,16.0,2018.0,477.0,,,,True
https://www.fragrantica.com/perfume/Mugler/A-Men-Pure-Energy-18982.html,,,,,,A*Men Pure Energy Mugler (male) ~ 2013,10.0,20.0,2013.0,508.0,,,,,,,,,,,,,,,,,,,,,,,,True
https://www.fragrantica.com/perfume/Reyane-Tradition/Insurrection-II-Wild-30721.html,,,,,,Insurrection II Wild Reyane Tradition (male),8.0,16.0,0.0,509.0,,,,,,,,,,,Insurrection II Wild Reyane Tradition (male),7.0,13.0,0.0,801.0,,,,,,,,,True
https://www.fragrantica.com/perfume/Mercedes-Benz/Le-Parfum-30710.html,,,,,,Le Parfum Mercedes-Benz (male) ~ 2015,5.0,10.0,2015.0,510.0,,,,,,,,,,,Le Parfum Mercedes-Benz (male) ~ 2015,4.0,11.0,2015.0,959.0,,,,,,,,,True
https://www.fragrantica.com/perfume/Aramis/Perfume-Calligraphy-Saffron-22961.html,,,,,,Perfume Calligraphy Saffron Aramis (unisex) ~ 2014,5.0,10.0,2014.0,511.0,,,,,,,,,,,,,,,,,,,,,,,,True
https://www.fragrantica.com/perfume/Rasasi/Dhanal-Oudh-Nashwah-41261.html,,,,,,Dhanal Oudh Nashwah Rasasi (unisex) ~ 2011,5.0,10.0,2011.0,512.0,,,,,,,,,,,,,,,,,,,,,,,,True
https://www.fragrantica.com/perfume/Ermenegildo-Zegna/Haitian-Vetiver-22478.html,,,,,,Haitian Vetiver Ermenegildo Zegna (male) ~ 2014,5.0,10.0,2014.0,513.0,Haitian Vetiver Ermenegildo Zegna (male) ~ 2014,10.0,9.0,2014.0,350.0,,,,,,,,,,,,,,,,,,,True
https://www.fragrantica.com/perfume/Hugo-Boss/Boss-The-Scent-Parfum-Edition-47460.html,,,,,,Boss The Scent Parfum Edition Hugo Boss (male) ~ 2017,4.0,8.0,2017.0,514.0,,,,,,,,,,,,,,,,,,,,,,,,True
https://www.fragrantica.com/perfume/Original-Penguin/Premium-Blend-38898.html,,,,,,Premium Blend Original Penguin (male) ~ 2016,5.0,10.0,2016.0,515.0,,,,,,,,,,,,,,,,,,,,,,,,True
https://www.fragrantica.com/perfume/Abdul-Samad-Al-Qurashi/Abdul-Samad-Al-Qurashi-Blend-21266.html,,,,,,Abdul Samad Al Qurashi Blend Abdul Samad Al Qurashi (male),1.0,2.0,0.0,520.0,,,,,,,,,,,,,,,,,,,,,,,,True
https://www.fragrantica.com/perfume/Abdul-Samad-Al-Qurashi/Safari-21300.html,,,,,,Safari Abdul Samad Al Qurashi (unisex),1.0,2.0,0.0,521.0,,,,,,,,,,,,,,,,,,,,,,,,True
https://www.fragrantica.com/perfume/Comme-des-Garcons/Scent-One-Hinoki-2558.html,,,,,,Scent One: Hinoki Comme des Garcons (male) ~ 2008,7.0,15.0,2008.0,522.0,Scent One: Hinoki Comme des Garcons (male) ~ 2008,3.0,1.0,2008.0,430.0,,,,,,,,,,,,,,,,,,,True
https://www.fragrantica.com/perfume/Tous/1920-The-Origin-46146.html,,,,,,1920 The Origin Tous (male) ~ 2017,6.0,13.0,2017.0,523.0,,,,,,,,,,,,,,,,,,,,,,,,True
https://www.fragrantica.com/perfume/Ormonde-Jayne/Nawab-of-Oudh-16897.html,,,,,,Nawab of Oudh Ormonde Jayne (unisex) ~ 2012,6.0,13.0,2012.0,524.0,,,,,,,,,,,,,,,,,,,,,,,,True
https://www.fragrantica.com/perfume/Byredo/Accord-Oud-10757.html,,,,,,Accord Oud Byredo (unisex) ~ 2010,6.0,13.0,2010.0,526.0,,,,,,,,,,,,,,,,,,,,,,,,True
https://www.fragrantica.com/perfume/SpongeBob-Squarepants/SpongeBob-28286.html,,,,,,SpongeBob SpongeBob Squarepants (unisex),7.0,15.0,0.0,527.0,,,,,,,,,,,,,,,,SpongeBob SpongeBob Squarepants (unisex),19.0,42.0,0.0,928.0,,,,True
https://www.fragrantica.com/perfume/Al-Haramain-Perfumes/L-Aventure-40405.html,,,,,,L'Aventure Al Haramain Perfumes (male) ~ 2016,7.0,15.0,2016.0,528.0,L'Aventure Al Haramain Perfumes (male) ~ 2016,3.0,4.0,2016.0,530.0,L'Aventure Al Haramain Perfumes (male) ~ 2016,9.0,18.0,2016.0,689.0,L'Aventure Al Haramain Perfumes (male) ~ 2016,1.0,1.0,2016.0,831.0,,,,,,,,,True
https://www.fragrantica.com/perfume/Jo-Malone-London/Wood-Sage-Sea-Salt-25529.html,,,,,,Wood Sage & Sea Salt Jo Malone London (unisex) ~ 2014,5.0,11.0,2014.0,529.0,,,,,,Wood Sage & Sea Salt Jo Malone London (unisex) ~ 2014,7.0,13.0,2014.0,606.0,,,,,,,,,,,,,,True
https://www.fragrantica.com/perfume/Etienne-Aigner/Aigner-man-2-2668.html,,,,,,Aigner |man|2 Etienne Aigner (male) ~ 2007,5.0,11.0,2007.0,530.0,,,,,,,,,,,,,,,,,,,,,,,,True
https://www.fragrantica.com/perfume/Acqua-di-Parma/Colonia-Quercia-38674.html,,,,,,Colonia Quercia Acqua di Parma (male) ~ 2016,5.0,11.0,2016.0,531.0,,,,,,,,,,,,,,,,,,,,,,,,True
https://www.fragrantica.com/perfume/Etat-Libre-d-Orange/Rien-Intense-Incense-24713.html,,,,,,Rien Intense Incense Etat Libre d'Orange (unisex) ~ 2014,5.0,11.0,2014.0,532.0,,,,,,,,,,,Rien Intense Incense Etat Libre d'Orange (unisex) ~ 2014,3.0,2.0,2014.0,663.0,,,,,,,,,True
https://www.fragrantica.com/perfume/Floris/Elite-5545.html,,,,,,Elite Floris (male) ~ 1980,4.0,9.0,1980.0,533.0,,,,,,,,,,,,,,,,,,,,,,,,True
https://www.fragrantica.com/perfume/Tom-Ford/Vanille-Fatale-48029.html,,,,,,Vanille Fatale Tom Ford (unisex) ~ 2017,6.0,13.0,2017.0,534.0,,,,,,,,,,,Vanille Fatale Tom Ford (unisex) ~ 2017,10.0,18.0,2017.0,730.0,,,,,,,,,True
https://www.fragrantica.com/perfume/Mercedes-Benz/Mercedes-Benz-Select-47001.html,,,,,,Mercedes-Benz Select Mercedes-Benz (male) ~ 2018,4.0,9.0,2018.0,536.0,,,,,,,,,,,,,,,,,,,,,,,,True
https://www.fragrantica.com/perfume/Naomi-Goodsir/Or-du-Serail-24716.html,,,,,,Or du Serail Naomi Goodsir (unisex) ~ 2014,3.0,7.0,2014.0,537.0,,,,,,,,,,,,,,,,,,,,,,,,True
https://www.fragrantica.com/perfume/Lalique/Encre-Noire-Sport-21369.html,,,,,,Encre Noire Sport Lalique (male) ~ 2013,7.0,15.0,2013.0,538.0,Encre Noire Sport Lalique (male) ~ 2013,12.0,5.0,2013.0,288.0,Encre Noire Sport Lalique (male) ~ 2013,26.0,18.0,2013.0,272.0,Encre Noire Sport Lalique (male) ~ 2013,142.0,75.0,2013.0,104.0,Encre Noire Sport Lalique (male) ~ 2013,111.0,60.0,2013.0,140.0,,,,True
https://www.fragrantica.com/perfume/Alfred-Dunhill/Icon-29229.html,,,,,,Icon Alfred Dunhill (male) ~ 2015,5.0,11.0,2015.0,539.0,Icon Alfred Dunhill (male) ~ 2015,63.0,61.0,2015.0,127.0,Icon Alfred Dunhill (male) ~ 2015,81.0,63.0,2015.0,135.0,Icon Alfred Dunhill (male) ~ 2015,56.0,29.0,2015.0,203.0,Icon Alfred Dunhill (male) ~ 2015,85.0,56.0,2015.0,183.0,,,,True
https://www.fragrantica.com/perfume/Dior/Oud-Ispahan-48384.html,,,,,,Oud Ispahan Dior (unisex) ~ 2018,5.0,11.0,2018.0,540.0,Oud Ispahan Dior (unisex) ~ 2018,19.0,21.0,2018.0,293.0,,,,,,,,,,,Oud Ispahan Dior (unisex) ~ 2018,9.0,20.0,2018.0,850.0,,,,True
https://www.fragrantica.com/perfume/Giorgio-Armani/Armani-Code-A-List-49501.html,,,,,,Armani Code A-List Giorgio Armani (male) ~ 2018,4.0,9.0,2018.0,541.0,,,,,,,,,,,Armani Code A-List Giorgio Armani (male) ~ 2018,2.0,0.0,2018.0,662.0,,,,,,,,,True
https://www.fragrantica.com/perfume/Maitre-Parfumeur-et-Gantier/Eau-des-Iles-5601.html,,,,,,Eau des Iles Maitre Parfumeur et Gantier (male) ~ 1988,3.0,7.0,1988.0,542.0,,,,,,Eau des Iles Maitre Parfumeur et Gantier (male) ~ 1988,2.0,6.0,1988.0,766.0,Eau des Iles Maitre Parfumeur et Gantier (male) ~ 1988,6.0,12.0,1988.0,843.0,,,,,,,,,True
https://www.fragrantica.com/perfume/Burberry/Mr-Burberry-Indigo-49095.html,,,,,,Mr. Burberry Indigo Burberry (male) ~ 2018,4.0,9.0,2018.0,543.0,,,,,,Mr. Burberry Indigo Burberry (male) ~ 2018,10.0,7.0,2018.0,432.0,,,,,,Mr. Burberry Indigo Burberry (male) ~ 2018,12.0,12.0,2018.0,536.0,,,,True
https://www.fragrantica.com/perfume/Masque-Milano/homage-to-Hemingway-47017.html,,,,,,(homage to) Hemingway Masque Milano (unisex) ~ 2018,4.0,9.0,2018.0,544.0,,,,,,(homage to) Hemingway Masque Milano (unisex) ~ 2018,4.0,1.0,2018.0,502.0,,,,,,,,,,,,,,True
https://www.fragrantica.com/perfume/Jacques-Fath/Green-Water-32569.html,,,,,,Green Water Jacques Fath (unisex) ~ 2015,3.0,7.0,2015.0,545.0,Green Water Jacques Fath (unisex) ~ 2015,1.0,1.0,2015.0,567.0,Green Water Jacques Fath (unisex) ~ 2015,7.0,7.0,2015.0,492.0,Green Water Jacques Fath (unisex) ~ 2015,4.0,9.0,2015.0,884.0,,,,,,,,,True
https://www.fragrantica.com/perfume/Maison-Francis-Kurkdjian/Oud-Cashmere-Mood-17661.html,,,,,,Oud Cashmere Mood Maison Francis Kurkdjian (unisex) ~ 2013,4.0,9.0,2013.0,547.0,,,,,,,,,,,,,,,,,,,,,,,,True
https://www.fragrantica.com/perfume/Nicolai-Parfumeur-Createur/Patchouli-Intense-21352.html,,,,,,Patchouli Intense Nicolai Parfumeur Createur (unisex),3.0,7.0,0.0,549.0,Patchouli Intense Nicolai Parfumeur Createur (unisex),3.0,0.0,0.0,408.0,,,,,,,,,,,,,,,,,,,True
https://www.fragrantica.com/perfume/Goldfield-Banks-Australia/Pacific-Rock-Moss-44120.html,,,,,,Pacific Rock Moss Goldfield & Banks Australia (unisex) ~ 2016,3.0,7.0,2016.0,550.0,,,,,,,,,,,,,,,,,,,,,,,,True
https://www.fragrantica.com/perfume/Yves-Saint-Laurent/6-place-Saint-Sulpice-47737.html,,,,,,6 place Saint Sulpice Yves Saint Laurent (unisex) ~ 2017,2.0,5.0,2017.0,551.0,,,,,,6 place Saint Sulpice Yves Saint Laurent (unisex) ~ 2017,2.0,4.0,2017.0,710.0,,,,,,6 place Saint Sulpice Yves Saint Laurent (unisex) ~ 2017,2.0,12.0,2017.0,1076.0,,,,True
https://www.fragrantica.com/perfume/Hugo-Boss/Boss-Bottled-Tonic-43331.html,,,,,,Boss Bottled Tonic Hugo Boss (male) ~ 2017,3.0,7.0,2017.0,552.0,,,,,,Boss Bottled Tonic Hugo Boss (male) ~ 2017,1.0,1.0,2017.0,665.0,,,,,,,,,,,,,,True
https://www.fragrantica.com/perfume/Salvatore-Ferragamo/Acqua-Essenziale-17089.html,,,,,,Acqua Essenziale Salvatore Ferragamo (male) ~ 2013,2.0,5.0,2013.0,553.0,,,,,,,,,,,,,,,,,,,,,,,,True
https://www.fragrantica.com/perfume/Tom-Ford/Noir-Eau-de-Toilette-21553.html,,,,,,Noir Eau de Toilette Tom Ford (male) ~ 2013,2.0,5.0,2013.0,554.0,,,,,,Noir Eau de Toilette Tom Ford (male) ~ 2013,3.0,10.0,2013.0,816.0,,,,,,,,,,,,,,True
https://www.fragrantica.com/perfume/Lalique/Lalique-Pour-Homme-1844.html,,,,,,Lalique Pour Homme Lalique (male) ~ 1997,2.0,5.0,1997.0,556.0,Lalique Pour Homme Lalique (male) ~ 1997,43.0,42.0,1997.0,168.0,,,,,,Lalique Pour Homme Lalique (male) ~ 1997,45.0,38.0,1997.0,256.0,Lalique Pour Homme Lalique (male) ~ 1997,45.0,47.0,1997.0,330.0,,,,True
https://www.fragrantica.com/perfume/John-Varvatos/Artisan-Blu-35456.html,,,,,,Artisan Blu John Varvatos (male) ~ 2016,12.0,26.0,2016.0,558.0,,,,,,,,,,,Artisan Blu John Varvatos (male) ~ 2016,9.0,11.0,2016.0,550.0,,,,,,,,,True
https://www.fragrantica.com/perfume/Abercrombie-Fitch/First-Instinct-37753.html,,,,,,First Instinct Abercrombie & Fitch (male) ~ 2016,9.0,20.0,2016.0,559.0,First Instinct Abercrombie & Fitch (male) ~ 2016,9.0,16.0,2016.0,508.0,,,,,,,,,,,,,,,,,,,True
https://www.fragrantica.com/perfume/Gucci/Gucci-Oud-25946.html,,,,,,Gucci Oud Gucci (unisex) ~ 2014,5.0,12.0,2014.0,561.0,,,,,,,,,,,,,,,,,,,,,,,,True
https://www.fragrantica.com/perfume/Areej-Le-Dore/Oud-Luwak-52239.html,,,,,,Oud Luwak Areej Le Doré (unisex) ~ 2018,5.0,12.0,2018.0,562.0,,,,,,,,,,,,,,,,,,,,,,,,True
https://www.fragrantica.com/perfume/Ferrari/Ferrari-Uomo-5888.html,,,,,,Ferrari Uomo Ferrari (male) ~ 2009,5.0,12.0,2009.0,563.0,Ferrari Uomo Ferrari (male) ~ 2009,1.0,3.0,2009.0,596.0,,,,,,,,,,,,,,,,,,,True
https://www.fragrantica.com/perfume/Calvin-Klein/Euphoria-Gold-Men-25813.html,,,,,,Euphoria Gold Men Calvin Klein (male) ~ 2014,5.0,12.0,2014.0,566.0,,,,,,,,,,,,,,,,,,,,,,,,True
https://www.fragrantica.com/perfume/Aramis/Perfume-Calligraphy-15123.html,,,,,,Perfume Calligraphy Aramis (unisex) ~ 2012,4.0,10.0,2012.0,567.0,,,,,,,,,,,,,,,,Perfume Calligraphy Aramis (unisex) ~ 2012,5.0,18.0,2012.0,1031.0,,,,True
https://www.fragrantica.com/perfume/Amouage/The-Library-Collection-Opus-X-35679.html,,,,,,The Library Collection Opus X Amouage (unisex) ~ 2016,5.0,12.0,2016.0,568.0,,,,,,The Library Collection Opus X Amouage (unisex) ~ 2016,1.0,1.0,2016.0,651.0,,,,,,,,,,,,,,True
https://www.fragrantica.com/perfume/Calvin-Klein/Euphoria-Amber-Gold-Men-49560.html,,,,,,Euphoria Amber Gold Men Calvin Klein (male) ~ 2018,5.0,12.0,2018.0,569.0,,,,,,,,,,,Euphoria Amber Gold Men Calvin Klein (male) ~ 2018,19.0,30.0,2018.0,535.0,Euphoria Amber Gold Men Calvin Klein (male) ~ 2018,9.0,14.0,2018.0,651.0,,,,True
https://www.fragrantica.com/perfume/Lattafa-Perfumes/Raghba-Wood-Intense-28713.html,,,,,,Raghba Wood Intense Lattafa Perfumes (male) ~ 2014,4.0,10.0,2014.0,570.0,,,,,,,,,,,,,,,,,,,,,,,,True
https://www.fragrantica.com/perfume/MiN-New-York/Coda-32465.html,,,,,,Coda MiN New York (unisex) ~ 2015,5.0,12.0,2015.0,571.0,,,,,,,,,,,,,,,,,,,,,,,,True
https://www.fragrantica.com/perfume/Azzaro/Wanted-38686.html,,,,,,Wanted Azzaro (male) ~ 2016,7.0,16.0,2016.0,572.0,Wanted Azzaro (male) ~ 2016,15.0,28.0,2016.0,506.0,Wanted Azzaro (male) ~ 2016,22.0,36.0,2016.0,479.0,Wanted Azzaro (male) ~ 2016,16.0,29.0,2016.0,686.0,Wanted Azzaro (male) ~ 2016,18.0,20.0,2016.0,496.0,,,,True
https://www.fragrantica.com/perfume/Diptyque/Oud-Palao-Eau-de-Parfum-31738.html,,,,,,Oud Palao Eau de Parfum Diptyque (unisex) ~ 2015,4.0,10.0,2015.0,573.0,,,,,,,,,,,Oud Palao Eau de Parfum Diptyque (unisex) ~ 2015,9.0,17.0,2015.0,788.0,Oud Palao Eau de Parfum Diptyque (unisex) ~ 2015,32.0,44.0,2015.0,455.0,,,,True
https://www.fragrantica.com/perfume/Montale/Dark-Aoud-12134.html,,,,,,Dark Aoud Montale (unisex) ~ 2011,4.0,10.0,2011.0,574.0,,,,,,,,,,,,,,,,,,,,,,,,True
https://www.fragrantica.com/perfume/Yves-Saint-Laurent/Caftan-32268.html,,,,,,Caftan Yves Saint Laurent (unisex) ~ 2015,4.0,10.0,2015.0,575.0,,,,,,,,,,,,,,,,,,,,,,,,True
https://www.fragrantica.com/perfume/Hermes/Hermessence-Cuir-d-Ange-26622.html,,,,,,Hermessence Cuir d'Ange Hermès (unisex) ~ 2014,4.0,10.0,2014.0,576.0,,,,,,,,,,,,,,,,,,,,,,,,True
https://www.fragrantica.com/perfume/House-Of-Sillage/HoS-N-001-35698.html,,,,,,HoS N.001 House Of Sillage (male) ~ 2016,3.0,8.0,2016.0,578.0,,,,,,,,,,,,,,,,,,,,,,,,True
https://www.fragrantica.com/perfume/Nimere-Parfums/Avowal-Klatva-49966.html,,,,,,Avowal (Клятва) Nimere Parfums (unisex) ~ 2018,3.0,8.0,2018.0,579.0,,,,,,,,,,,,,,,,,,,,,,,,True
https://www.fragrantica.com/perfume/Masque-Milano/Tango-20693.html,,,,,,Tango Masque Milano (unisex) ~ 2013,2.0,6.0,2013.0,580.0,,,,,,Tango Masque Milano (unisex) ~ 2013,14.0,9.0,2013.0,365.0,,,,,,,,,,,,,,True
https://www.fragrantica.com/perfume/Faberlic/Celsius-38484.html,,,,,,Celsius Faberlic (male) ~ 2016,1.0,4.0,2016.0,581.0,,,,,,Celsius Faberlic (male) ~ 2016,1.0,1.0,2016.0,667.0,,,,,,,,,,,,,,True
https://www.fragrantica.com/perfume/Amouage/Myths-Man-38259.html,,,,,,Myths Man Amouage (male) ~ 2016,12.0,27.0,2016.0,582.0,,,,,,Myths Man Amouage (male) ~ 2016,16.0,16.0,2016.0,394.0,Myths Man Amouage (male) ~ 2016,21.0,31.0,2016.0,483.0,Myths Man Amouage (male) ~ 2016,13.0,30.0,2016.0,925.0,,,,True
https://www.fragrantica.com/perfume/Salvatore-Ferragamo/Incense-Suede-26779.html,,,,,,Incense Suede Salvatore Ferragamo (unisex) ~ 2014,8.0,19.0,2014.0,584.0,,,,,,,,,,,,,,,,,,,,,,,,True
https://www.fragrantica.com/perfume/Richard-James/Savile-Row-26153.html,,,,,,Savile Row Richard James (male) ~ 2003,6.0,15.0,2003.0,585.0,,,,,,,,,,,Savile Row Richard James (male) ~ 2003,7.0,19.0,2003.0,1012.0,,,,,,,,,True
https://www.fragrantica.com/perfume/Penhaligon-s/Elixir-5673.html,,,,,,Elixir Penhaligon's (unisex) ~ 2008,8.0,19.0,2008.0,586.0,,,,,,,,,,,,,,,,,,,,,,,,True
https://www.fragrantica.com/perfume/Carner-Barcelona/Palo-Santo-31035.html,,,,,,Palo Santo Carner Barcelona (unisex) ~ 2015,5.0,13.0,2015.0,587.0,,,,,,,,,,,,,,,,,,,,,,,,True
https://www.fragrantica.com/perfume/Giorgio-Armani/Armani-Prive-Bleu-Turquoise-48060.html,,,,,,Armani Privé Bleu Turquoise Giorgio Armani (unisex) ~ 2018,5.0,13.0,2018.0,588.0,,,,,,,,,,,,,,,,,,,,,,,,True
https://www.fragrantica.com/perfume/Parfums-de-Marly/Byerley-31876.html,,,,,,Byerley Parfums de Marly (male) ~ 2014,4.0,11.0,2014.0,589.0,,,,,,,,,,,,,,,,,,,,,,,,True
https://www.fragrantica.com/perfume/MiN-New-York/Dahab-25509.html,,,,,,Dahab MiN New York (unisex) ~ 2014,4.0,11.0,2014.0,590.0,,,,,,,,,,,,,,,,,,,,,,,,True
https://www.fragrantica.com/perfume/Elie-Saab/Essence-No-4-Oud-25917.html,,,,,,Essence No. 4 Oud Elie Saab (unisex) ~ 2014,4.0,11.0,2014.0,591.0,Essence No. 4 Oud Elie Saab (unisex) ~ 2014,8.0,18.0,2014.0,606.0,,,,,,,,,,,,,,,,,,,True
https://www.fragrantica.com/perfume/Jil-Sander/Sun-Men-619.html,,,,,,Sun Men Jil Sander (male) ~ 2002,4.0,11.0,2002.0,593.0,,,,,,,,,,,,,,,,,,,,,,,,True
https://www.fragrantica.com/perfume/Halloween/Halloween-Man-Shot-40999.html,,,,,,Halloween Man Shot Halloween (male) ~ 2016,6.0,15.0,2016.0,594.0,,,,,,,,,,,,,,,,,,,,,,,,True
https://www.fragrantica.com/perfume/Loewe/Esencia-pour-Homme-Eau-de-Parfum-52268.html,,,,,,Esencia pour Homme Eau de Parfum Loewe (male) ~ 2018,4.0,11.0,2018.0,596.0,Esencia pour Homme Eau de Parfum Loewe (male) ~ 2018,3.0,2.0,2018.0,451.0,,,,,,Esencia pour Homme Eau de Parfum Loewe (male) ~ 2018,13.0,17.0,2018.0,521.0,Esencia pour Homme Eau de Parfum Loewe (male) ~ 2018,12.0,13.0,2018.0,544.0,,,,True
https://www.fragrantica.com/perfume/Tom-Ford/Moss-Breches-1827.html,,,,,,Moss Breches Tom Ford (unisex) ~ 2007,4.0,11.0,2007.0,598.0,,,,,,Moss Breches Tom Ford (unisex) ~ 2007,4.0,9.0,2007.0,727.0,,,,,,,,,,,,,,True
https://www.fragrantica.com/perfume/Etat-Libre-d-Orange/Remarkable-People-30504.html,,,,,,Remarkable People Etat Libre d'Orange (unisex) ~ 2015,4.0,11.0,2015.0,599.0,,,,,,,,,,,,,,,,,,,,,,,,True
https://www.fragrantica.com/perfume/The-Merchant-of-Venice/Sultan-Leather-32669.html,,,,,,Sultan Leather The Merchant of Venice (male) ~ 2015,3.0,9.0,2015.0,600.0,,,,,,,,,,,,,,,,,,,,,,,,True
https://www.fragrantica.com/perfume/Alfred-Dunhill/Dunhill-1939.html,,,,,,Dunhill Alfred Dunhill (male) ~ 2003,3.0,9.0,2003.0,601.0,,,,,,,,,,,,,,,,,,,,,,,,True
https://www.fragrantica.com/perfume/Santa-Maria-Novella/Acqua-di-Colonia-Cinquanta-31439.html,,,,,,Acqua di Colonia Cinquanta Santa Maria Novella (unisex) ~ 2015,2.0,7.0,2015.0,604.0,,,,,,,,,,,,,,,,,,,,,,,,True
https://www.fragrantica.com/perfume/Givenchy/Eau-de-Givenchy-2018-49600.html,,,,,,Eau de Givenchy (2018) Givenchy (unisex) ~ 2018,4.0,12.0,2018.0,606.0,,,,,,,,,,,,,,,,,,,,,,,,True
https://www.fragrantica.com/perfume/Calvin-Klein/Obsessed-for-Men-45709.html,,,,,,Obsessed for Men Calvin Klein (male) ~ 2017,7.0,18.0,2017.0,607.0,,,,,,,,,,,,,,,,,,,,,,,,True
https://www.fragrantica.com/perfume/Slumberhouse/Grev-11742.html,,,,,,Grev Slumberhouse (male) ~ 2009,5.0,14.0,2009.0,608.0,,,,,,,,,,,,,,,,,,,,,,,,True
https://www.fragrantica.com/perfume/Montana/Graphite-13518.html,,,,,,Graphite Montana (male) ~ 2011,5.0,14.0,2011.0,609.0,,,,,,,,,,,Graphite Montana (male) ~ 2011,5.0,15.0,2011.0,1013.0,,,,,,,,,True
https://www.fragrantica.com/perfume/Carner-Barcelona/El-Born-25936.html,,,,,,El Born Carner Barcelona (unisex) ~ 2014,6.0,16.0,2014.0,610.0,,,,,,,,,,,,,,,,,,,,,,,,True
https://www.fragrantica.com/perfume/Diptyque/Eau-des-Sens-Eau-de-Toilette-35678.html,,,,,,Eau des Sens Eau de Toilette Diptyque (unisex) ~ 2016,3.0,10.0,2016.0,611.0,,,,,,,,,,,,,,,,,,,,,,,,True
https://www.fragrantica.com/perfume/Xerjoff/Mefisto-Gentiluomo-52432.html,,,,,,Mefisto Gentiluomo Xerjoff (male) ~ 2018,4.0,12.0,2018.0,612.0,,,,,,Mefisto Gentiluomo Xerjoff (male) ~ 2018,3.0,1.0,2018.0,538.0,,,,,,Mefisto Gentiluomo Xerjoff (male) ~ 2018,16.0,38.0,2018.0,964.0,,,,True
https://www.fragrantica.com/perfume/DS-Durga/Mississippi-Medicine-12013.html,,,,,,Mississippi Medicine DS&Durga (male) ~ 2011,3.0,10.0,2011.0,613.0,,,,,,,,,,,,,,,,,,,,,,,,True
