https://www.fragrantica.com/perfume/Guerlain/Spiritueuse-Double-Vanille-38809.html,,,,,,,,,,,,,,,,Spiritueuse Double Vanille Guerlain (unisex) ~ 2016,9.0,18.0,2016.0,681.0,,,,,,,,,,,,,,True
https://www.fragrantica.com/perfume/Creed/Acier-Aluminium-7498.html,,,,,,,,,,,,,,,,Acier Aluminium Creed (male) ~ 1973,9.0,18.0,1973.0,686.0,,,,,,Acier Aluminium Creed (male) ~ 1973,1.0,15.0,1973.0,1167.0,,,,True
https://www.fragrantica.com/perfume/Nishane/Vjola-30584.html,,,,,,,,,,,,,,,,Vjola Nishane (unisex) ~ 2014,6.0,12.0,2014.0,687.0,,,,,,,,,,,,,,True
https://www.fragrantica.com/perfume/Carolina-Herrera/Herrera-Aqua-288.html,,,,,,,,,,,,,,,,Herrera Aqua Carolina Herrera (male) ~ 2004,7.0,14.0,2004.0,690.0,,,,,,Herrera Aqua Carolina Herrera (male) ~ 2004,1.0,3.0,2004.0,829.0,,,,True
https://www.fragrantica.com/perfume/Antonio-Banderas/Blue-Seduction-1088.html,,,,,,,,,,,,,,,,Blue Seduction Antonio Banderas (male) ~ 2007,10.0,20.0,2007.0,693.0,Blue Seduction Antonio Banderas (male) ~ 2007,34.0,41.0,2007.0,349.0,Blue Seduction Antonio Banderas (male) ~ 2007,22.0,35.0,2007.0,572.0,,,,True
https://www.fragrantica.com/perfume/John-Varvatos/JV-x-NJ-51057.html,,,,,,,,,,,,,,,,JV x NJ John Varvatos (male) ~ 2018,6.0,12.0,2018.0,694.0,,,,,,,,,,,,,,True
https://www.fragrantica.com/perfume/Givenchy/Pi-Fraiche-2946.html,,,,,,,,,,,,,,,,Pi Fraiche Givenchy (male) ~ 2001,4.0,8.0,2001.0,695.0,,,,,,,,,,,,,,True
https://www.fragrantica.com/perfume/Donna-Karan/DK-501.html,,,,,,,,,,,,,,,,DK Donna Karan (male) ~ 1994,4.0,8.0,1994.0,696.0,DK Donna Karan (male) ~ 1994,1.0,0.0,1994.0,780.0,,,,,,,,,True
https://www.fragrantica.com/perfume/Baldessarini/Del-Mar-Baldessarini-386.html,,,,,,,,,,,,,,,,Del Mar Baldessarini Baldessarini (male) ~ 2005,7.0,14.0,2005.0,697.0,,,,,,,,,,,,,,True
https://www.fragrantica.com/perfume/Louis-Vuitton/Nouveau-Monde-49753.html,,,,,,,,,,,,,,,,Nouveau Monde Louis Vuitton (male) ~ 2018,4.0,8.0,2018.0,699.0,Nouveau Monde Louis Vuitton (male) ~ 2018,1.0,6.0,2018.0,1009.0,Nouveau Monde Louis Vuitton (male) ~ 2018,3.0,3.0,2018.0,683.0,,,,True
https://www.fragrantica.com/perfume/Maison-Francis-Kurkdjian/Gentle-Fluidity-Silver-53400.html,,,,,,,,,,,,,,,,Gentle Fluidity Silver Maison Francis Kurkdjian (unisex) ~ 2019,7.0,14.0,2019.0,702.0,Gentle Fluidity Silver Maison Francis Kurkdjian (unisex) ~ 2019,17.0,24.0,2019.0,503.0,Gentle Fluidity Silver Maison Francis Kurkdjian (unisex) ~ 2019,102.0,63.0,2019.0,162.0,,,,True
https://www.fragrantica.com/perfume/Rania-J/Cuir-Andalou-37732.html,,,,,,,,,,,,,,,,Cuir Andalou Rania J (unisex) ~ 2016,2.0,4.0,2016.0,703.0,,,,,,,,,,,,,,True
https://www.fragrantica.com/perfume/Frederic-Malle/Dries-Van-Noten-par-Frederic-Malle-17481.html,,,,,,,,,,,,,,,,Dries Van Noten par Frederic Malle Frederic Malle (unisex) ~ 2013,3.0,6.0,2013.0,704.0,,,,,,,,,,,,,,True
https://www.fragrantica.com/perfume/Dior/La-Collection-Couturier-Parfumeur-Vetiver-10632.html,,,,,,,,,,,,,,,,La Collection Couturier Parfumeur Vetiver Dior (male) ~ 2010,2.0,4.0,2010.0,706.0,,,,,,,,,,,,,,True
https://www.fragrantica.com/perfume/Caron/L-Anarchiste-6380.html,,,,,,,,,,,,,,,,L'Anarchiste Caron (male) ~ 2000,3.0,6.0,2000.0,707.0,,,,,,,,,,,,,,True
https://www.fragrantica.com/perfume/Tom-Ford/Black-Orchid-Parfum-62199.html,,,,,,,,,,,,,,,,Black Orchid Parfum Tom Ford (unisex) ~ 2020,7.0,14.0,2020.0,708.0,Black Orchid Parfum Tom Ford (unisex) ~ 2020,21.0,26.0,2020.0,438.0,Black Orchid Parfum Tom Ford (unisex) ~ 2020,71.0,55.0,2020.0,219.0,,,,True
https://www.fragrantica.com/perfume/Issey-Miyake/L-Eau-d-Issey-pour-Homme-Wood-Wood-55797.html,,,,,,,,,,,,,,,,L'Eau d'Issey pour Homme Wood & Wood Issey Miyake (male) ~ 2019,2.0,4.0,2019.0,711.0,L'Eau d'Issey pour Homme Wood & Wood Issey Miyake (male) ~ 2019,9.0,14.0,2019.0,632.0,,,,,,,,,True
https://www.fragrantica.com/perfume/Guess/Guess-Seductive-Noir-Homme-56993.html,,,,,,,,,,,,,,,,Guess Seductive Noir Homme Guess (male) ~ 2019,1.0,2.0,2019.0,712.0,,,,,,,,,,,,,,True
https://www.fragrantica.com/perfume/Dans-un-Jardin/Terre-42838.html,,,,,,,,,,,,,,,,Terre Dans un Jardin (male),0.0,0.0,0.0,714.0,,,,,,,,,,,,,,True
https://www.fragrantica.com/perfume/Parfums-de-Marly/Kalan-56036.html,,,,,,,,,,,,,,,,Kalan Parfums de Marly (unisex) ~ 2019,20.0,41.0,2019.0,715.0,Kalan Parfums de Marly (unisex) ~ 2019,16.0,19.0,2019.0,471.0,Kalan Parfums de Marly (unisex) ~ 2019,39.0,33.0,2019.0,319.0,,,,True
https://www.fragrantica.com/perfume/Amouage/The-Library-Collection-Opus-VIII-24138.html,,,,,,,,,,,,,,,,The Library Collection Opus VIII Amouage (unisex) ~ 2014,9.0,19.0,2014.0,716.0,,,,,,,,,,,,,,True
https://www.fragrantica.com/perfume/Gucci/Gucci-Guilty-Cologne-pour-Homme-53867.html,,,,,,,,,,,,,,,,Gucci Guilty Cologne pour Homme Gucci (male) ~ 2019,12.0,25.0,2019.0,717.0,Gucci Guilty Cologne pour Homme Gucci (male) ~ 2019,13.0,24.0,2019.0,715.0,,,,,,,,,True
https://www.fragrantica.com/perfume/Naomi-Goodsir/Nuit-de-Bakelite-43954.html,,,,,,,,,,,,,,,,Nuit de Bakélite Naomi Goodsir (unisex) ~ 2017,10.0,21.0,2017.0,718.0,Nuit de Bakélite Naomi Goodsir (unisex) ~ 2017,6.0,15.0,2017.0,953.0,,,,,,,,,True
https://www.fragrantica.com/perfume/Jean-Paul-Gaultier/Le-Male-Superman-Eau-Fraiche-43712.html,,,,,,,,,,,,,,,,Le Male Superman Eau Fraiche Jean Paul Gaultier (male) ~ 2017,13.0,27.0,2017.0,720.0,,,,,,Le Male Superman Eau Fraiche Jean Paul Gaultier (male) ~ 2017,4.0,6.0,2017.0,715.0,,,,True
https://www.fragrantica.com/perfume/Lanvin/L-Homme-Sport-5717.html,,,,,,,,,,,,,,,,L'Homme Sport Lanvin (male) ~ 2009,5.0,11.0,2009.0,721.0,,,,,,,,,,,,,,True
https://www.fragrantica.com/perfume/Calvin-Klein/Eternity-Now-For-Men-31000.html,,,,,,,,,,,,,,,,Eternity Now For Men Calvin Klein (male) ~ 2015,4.0,9.0,2015.0,723.0,,,,,,,,,,,,,,True
https://www.fragrantica.com/perfume/Baldessarini/Baldessarini-Eau-de-Cologne-Concentree-60135.html,,,,,,,,,,,,,,,,Baldessarini Eau de Cologne Concentree Baldessarini (male) ~ 2020,2.0,5.0,2020.0,725.0,,,,,,,,,,,,,,True
https://www.fragrantica.com/perfume/Calvin-Klein/CK-Free-6281.html,,,,,,,,,,,,,,,,CK Free Calvin Klein (male) ~ 2009,4.0,9.0,2009.0,728.0,,,,,,,,,,,,,,True
https://www.fragrantica.com/perfume/Calaj/Metaphore-WJ-63478.html,,,,,,,,,,,,,,,,Metaphore WJ Calaj (unisex) ~ 2020,2.0,5.0,2020.0,729.0,,,,,,,,,,,,,,True
https://www.fragrantica.com/perfume/Acqua-di-Parma/Note-di-Colonia-IV-46376.html,,,,,,,,,,,,,,,,Note di Colonia IV Acqua di Parma (unisex) ~ 2017,3.0,7.0,2017.0,730.0,Note di Colonia IV Acqua di Parma (unisex) ~ 2017,9.0,15.0,2017.0,677.0,,,,,,,,,True
https://www.fragrantica.com/perfume/Carolina-Herrera/212-Men-on-Ice-2006-305.html,,,,,,,,,,,,,,,,212 Men on Ice 2006 Carolina Herrera (male) ~ 2006,3.0,7.0,2006.0,731.0,,,,,,,,,,,,,,True
https://www.fragrantica.com/perfume/Floris/Leather-Oud-25613.html,,,,,,,,,,,,,,,,Leather Oud Floris (unisex) ~ 2014,3.0,7.0,2014.0,732.0,,,,,,,,,,,,,,True
https://www.fragrantica.com/perfume/Roja-Dove/Roja-Haute-Luxe-21359.html,,,,,,,,,,,,,,,,Roja Haute Luxe Roja Dove (unisex) ~ 2013,1.0,3.0,2013.0,733.0,,,,,,Roja Haute Luxe Roja Dove (unisex) ~ 2013,3.0,14.0,2013.0,1068.0,,,,True
https://www.fragrantica.com/perfume/Etat-Libre-d-Orange/Sex-Pistols-10083.html,,,,,,,,,,,,,,,,Sex Pistols Etat Libre d'Orange (unisex) ~ 2010,1.0,3.0,2010.0,734.0,,,,,,,,,,,,,,True
https://www.fragrantica.com/perfume/Bath-Body-Works/Ocean-45337.html,,,,,,,,,,,,,,,,Ocean Bath & Body Works (male) ~ 2017,1.0,3.0,2017.0,735.0,,,,,,,,,,,,,,True
https://www.fragrantica.com/perfume/Le-Labo/Another-13-10131.html,,,,,,,,,,,,,,,,Another 13 Le Labo (unisex) ~ 2010,2.0,5.0,2010.0,736.0,Another 13 Le Labo (unisex) ~ 2010,8.0,15.0,2010.0,796.0,Another 13 Le Labo (unisex) ~ 2010,32.0,53.0,2010.0,538.0,,,,True
https://www.fragrantica.com/perfume/Mauboussin/Private-Club-for-Men-51867.html,,,,,,,,,,,,,,,,Private Club for Men Mauboussin (male) ~ 2018,2.0,5.0,2018.0,737.0,,,,,,,,,,,,,,True
https://www.fragrantica.com/perfume/Amouage/Tribute-7490.html,,,,,,,,,,,,,,,,Tribute Amouage (unisex) ~ 2009,2.0,5.0,2009.0,739.0,,,,,,Tribute Amouage (unisex) ~ 2009,7.0,23.0,2009.0,1099.0,,,,True
https://www.fragrantica.com/perfume/Mendittorosa/Le-Mat-25138.html,,,,,,,,,,,,,,,,Le Mat Mendittorosa (unisex) ~ 2014,2.0,5.0,2014.0,740.0,,,,,,,,,,,,,,True
https://www.fragrantica.com/perfume/Penhaligon-s/Much-Ado-About-The-Duke-40713.html,,,,,,,,,,,,,,,,Much Ado About The Duke Penhaligon's (male) ~ 2016,2.0,5.0,2016.0,744.0,,,,,,,,,,,,,,True
https://www.fragrantica.com/perfume/Cuba-Paris/Cuba-Royal-13802.html,,,,,,,,,,,,,,,,Cuba Royal Cuba Paris (male),3.0,7.0,0.0,749.0,,,,,,,,,,,,,,True
https://www.fragrantica.com/perfume/O-Boticario/Malbec-Flame-62738.html,,,,,,,,,,,,,,,,Malbec Flame O Boticário (male) ~ 2020,1.0,3.0,2020.0,751.0,,,,,,,,,,,,,,True
https://www.fragrantica.com/perfume/Amouage/The-Library-Collection-Opus-IV-10756.html,,,,,,,,,,,,,,,,The Library Collection Opus IV Amouage (unisex) ~ 2010,10.0,22.0,2010.0,752.0,,,,,,,,,,,,,,True
https://www.fragrantica.com/perfume/Escentric-Molecules/Molecule-02-3606.html,,,,,,,,,,,,,,,,Molecule 02 Escentric Molecules (unisex) ~ 2008,11.0,24.0,2008.0,754.0,Molecule 02 Escentric Molecules (unisex) ~ 2008,10.0,18.0,2008.0,729.0,,,,,,,,,True
https://www.fragrantica.com/perfume/Jo-Malone-London/Rose-White-Musk-Absolu-49923.html,,,,,,,,,,,,,,,,Rose & White Musk Absolu Jo Malone London (unisex) ~ 2018,5.0,12.0,2018.0,756.0,,,,,,,,,,,,,,True
https://www.fragrantica.com/perfume/Francesca-Bianchi/Sex-And-The-Sea-Neroli-54515.html,,,,,,,,,,,,,,,,Sex And The Sea Neroli Francesca Bianchi (unisex) ~ 2019,5.0,12.0,2019.0,757.0,,,,,,,,,,,,,,True
https://www.fragrantica.com/perfume/Orto-Parisi/Megamare-53471.html,,,,,,,,,,,,,,,,Megamare Orto Parisi (unisex) ~ 2019,6.0,14.0,2019.0,758.0,Megamare Orto Parisi (unisex) ~ 2019,12.0,20.0,2019.0,634.0,Megamare Orto Parisi (unisex) ~ 2019,31.0,37.0,2019.0,419.0,,,,True
https://www.fragrantica.com/perfume/Rania-J/Ambre-Loup-14926.html,,,,,,,,,,,,,,,,Ambre Loup Rania J (unisex) ~ 2012,6.0,14.0,2012.0,759.0,,,,,,,,,,,,,,True
https://www.fragrantica.com/perfume/The-Spirit-of-Dubai/Meydan-30526.html,,,,,,,,,,,,,,,,Meydan The Spirit of Dubai (unisex) ~ 2015,4.0,10.0,2015.0,760.0,,,,,,,,,,,,,,True
https://www.fragrantica.com/perfume/Montale/Arabians-Tonka-57384.html,,,,,,,,,,,,,,,,Arabians Tonka Montale (unisex) ~ 2019,5.0,12.0,2019.0,762.0,Arabians Tonka Montale (unisex) ~ 2019,5.0,8.0,2019.0,742.0,Arabians Tonka Montale (unisex) ~ 2019,4.0,26.0,2019.0,1174.0,,,,True
https://www.fragrantica.com/perfume/Lanman-Kemp/Florida-Water-33793.html,,,,,,,,,,,,,,,,Florida Water Lanman & Kemp (unisex) ~ 1808,3.0,8.0,1808.0,763.0,,,,,,,,,,,,,,True
https://www.fragrantica.com/perfume/Baldessarini/Del-Mar-Seychelles-Limited-Edition-5716.html,,,,,,,,,,,,,,,,Del Mar Seychelles Limited Edition Baldessarini (male) ~ 2009,2.0,6.0,2009.0,764.0,,,,,,,,,,,,,,True
https://www.fragrantica.com/perfume/Jacques-Fath/Bel-Ambre-32570.html,,,,,,,,,,,,,,,,Bel Ambre Jacques Fath (unisex) ~ 2015,1.0,4.0,2015.0,765.0,,,,,,,,,,,,,,True
https://www.fragrantica.com/perfume/Rasasi/Oudh-Al-Boruzz-Asrar-Indonesia-45039.html,,,,,,,,,,,,,,,,Oudh Al Boruzz Asrar Indonesia Rasasi (unisex) ~ 2015,2.0,6.0,2015.0,767.0,Oudh Al Boruzz Asrar Indonesia Rasasi (unisex) ~ 2015,4.0,13.0,2015.0,1016.0,,,,,,,,,True
https://www.fragrantica.com/perfume/Marc-Antoine-Barrois/B683-46802.html,,,,,,,,,,,,,,,,B683 Marc-Antoine Barrois (male) ~ 2016,4.0,11.0,2016.0,769.0,,,,,,,,,,,,,,True
https://www.fragrantica.com/perfume/Davidoff/The-Game-17087.html,,,,,,,,,,,,,,,,The Game Davidoff (male) ~ 2012,8.0,19.0,2012.0,770.0,,,,,,,,,,,,,,True
https://www.fragrantica.com/perfume/Joop/Joop-Jump-1040.html,,,,,,,,,,,,,,,,Joop! Jump Joop! (male) ~ 2005,7.0,17.0,2005.0,771.0,,,,,,Joop! Jump Joop! (male) ~ 2005,11.0,24.0,2005.0,843.0,,,,True
https://www.fragrantica.com/perfume/Lacoste-Fragrances/L-Homme-Lacoste-46027.html,,,,,,,,,,,,,,,,L'Homme Lacoste Lacoste Fragrances (male) ~ 2017,5.0,13.0,2017.0,773.0,,,,,,,,,,,,,,True
https://www.fragrantica.com/perfume/Bois-1920/Oltremare-13187.html,,,,,,,,,,,,,,,,Oltremare Bois 1920 (unisex) ~ 2011,2.0,7.0,2011.0,774.0,,,,,,,,,,,,,,True
https://www.fragrantica.com/perfume/Maurer-Wirtz/Tabac-Man-1756.html,,,,,,,,,,,,,,,,Tabac Man Maurer & Wirtz (male),2.0,7.0,0.0,776.0,,,,,,,,,,,,,,True
https://www.fragrantica.com/perfume/Antonio-Puig/Brummel-19442.html,,,,,,,,,,,,,,,,Brummel Antonio Puig (male) ~ 1975,2.0,7.0,1975.0,778.0,,,,,,,,,,,,,,True
https://www.fragrantica.com/perfume/Alvarez-Gomez/Agua-de-Colonia-Concentrada-Barberia-20421.html,,,,,,,,,,,,,,,,Agua de Colonia Concentrada Barberia Alvarez Goméz (unisex) ~ 2012,2.0,7.0,2012.0,779.0,,,,,,,,,,,,,,True
https://www.fragrantica.com/perfume/Ted-Lapidus/Lapidus-Pour-Homme-Sport-32627.html,,,,,,,,,,,,,,,,Lapidus Pour Homme Sport Ted Lapidus (male) ~ 2015,2.0,7.0,2015.0,780.0,,,,,,,,,,,,,,True
https://www.fragrantica.com/perfume/Baldessarini/Baldessarini-Black-56762.html,,,,,,,,,,,,,,,,Baldessarini Black Baldessarini (male) ~ 2019,2.0,7.0,2019.0,781.0,,,,,,,,,,,,,,True
https://www.fragrantica.com/perfume/Bortnikoff/Mysterious-Oud-50940.html,,,,,,,,,,,,,,,,Mysterious Oud Bortnikoff (unisex) ~ 2018,1.0,5.0,2018.0,782.0,,,,,,,,,,,,,,True
https://www.fragrantica.com/perfume/Tom-Daxon/Reverie-18355.html,,,,,,,,,,,,,,,,Reverie Tom Daxon (unisex) ~ 2013,1.0,5.0,2013.0,783.0,,,,,,,,,,,,,,True
https://www.fragrantica.com/perfume/Masque-Milano/Mandala-43832.html,,,,,,,,,,,,,,,,Mandala Masque Milano (unisex) ~ 2017,2.0,7.0,2017.0,784.0,,,,,,,,,,,,,,True
https://www.fragrantica.com/perfume/Carolina-Herrera/212-Men-On-Ice-2009-5900.html,,,,,,,,,,,,,,,,212 Men On Ice 2009 Carolina Herrera (male) ~ 2009,2.0,7.0,2009.0,785.0,,,,,,,,,,,,,,True
https://www.fragrantica.com/perfume/April-Aromatics/Precious-Woods-14693.html,,,,,,,,,,,,,,,,Precious Woods April Aromatics (unisex) ~ 2012,1.0,5.0,2012.0,787.0,,,,,,,,,,,,,,True
https://www.fragrantica.com/perfume/April-Aromatics/Erdenstern-29094.html,,,,,,,,,,,,,,,,Erdenstern April Aromatics (unisex) ~ 2014,1.0,5.0,2014.0,788.0,,,,,,,,,,,,,,True
https://www.fragrantica.com/perfume/Serge-Lutens/Jeux-de-Peau-11350.html,,,,,,,,,,,,,,,,Jeux de Peau Serge Lutens (unisex) ~ 2011,1.0,5.0,2011.0,789.0,,,,,,,,,,,,,,True
https://www.fragrantica.com/perfume/Jimmy-Choo/Jimmy-Choo-Man-Blue-49723.html,,,,,,,,,,,,,,,,Jimmy Choo Man Blue Jimmy Choo (male) ~ 2018,2.0,7.0,2018.0,790.0,Jimmy Choo Man Blue Jimmy Choo (male) ~ 2018,1.0,1.0,2018.0,828.0,,,,,,,,,True
https://www.fragrantica.com/perfume/Tiziana-Terenzi/Foconero-44358.html,,,,,,,,,,,,,,,,Foconero Tiziana Terenzi (unisex) ~ 2017,1.0,5.0,2017.0,791.0,,,,,,,,,,,,,,True
https://www.fragrantica.com/perfume/Ramon-Monegal/Bravo-38740.html,,,,,,,,,,,,,,,,Bravo Ramon Monegal (unisex) ~ 2015,1.0,5.0,2015.0,792.0,,,,,,,,,,,,,,True
https://www.fragrantica.com/perfume/Prissana/Haxan-51725.html,,,,,,,,,,,,,,,,Haxan Prissana (unisex) ~ 2018,1.0,5.0,2018.0,793.0,,,,,,,,,,,,,,True
https://www.fragrantica.com/perfume/Laurent-Mazzone-Parfums/Cicatrices-30556.html,,,,,,,,,,,,,,,,Cicatrices Laurent Mazzone Parfums (unisex) ~ 2015,1.0,5.0,2015.0,794.0,,,,,,,,,,,,,,True
https://www.fragrantica.com/perfume/Aquolina/Blue-Sugar-976.html,,,,,,,,,,,,,,,,Blue Sugar Aquolina (male) ~ 2006,1.0,5.0,2006.0,797.0,,,,,,,,,,,,,,True
https://www.fragrantica.com/perfume/Jo-Malone-London/Velvet-Rose-Oud-15286.html,,,,,,,,,,,,,,,,Velvet Rose & Oud Jo Malone London (unisex) ~ 2012,6.0,16.0,2012.0,800.0,,,,,,,,,,,,,,True
https://www.fragrantica.com/perfume/Les-Liquides-Imaginaires/Beaute-du-Diable-54645.html,,,,,,,,,,,,,,,,Beaute du Diable Les Liquides Imaginaires (unisex) ~ 2019,2.0,8.0,2019.0,802.0,,,,,,,,,,,,,,True
https://www.fragrantica.com/perfume/Paul-Sebastian/PS-Fine-Cologne-5043.html,,,,,,,,,,,,,,,,PS Fine Cologne Paul Sebastian (male) ~ 1979,3.0,10.0,1979.0,804.0,,,,,,,,,,,,,,True
https://www.fragrantica.com/perfume/Maison-Sybarite/720-57075.html,,,,,,,,,,,,,,,,720 Maison Sybarite (unisex) ~ 2019,1.0,6.0,2019.0,805.0,,,,,,,,,,,,,,True
https://www.fragrantica.com/perfume/Korres/L-eau-de-Parfum-20-41273.html,,,,,,,,,,,,,,,,L'eau de Parfum 20 Korres (male) ~ 2016,2.0,8.0,2016.0,806.0,,,,,,,,,,,,,,True
https://www.fragrantica.com/perfume/BZ-Parfums/Alea-77-Dekhtiari-52038.html,,,,,,,,,,,,,,,,Alea 77 Dekhtiari BZ Parfums (unisex) ~ 2016,1.0,6.0,2016.0,807.0,,,,,,,,,,,,,,True
https://www.fragrantica.com/perfume/BZ-Parfums/Mr-Idol-30779.html,,,,,,,,,,,,,,,,Mr. Idol BZ Parfums (male),1.0,6.0,0.0,808.0,,,,,,,,,,,,,,True
https://www.fragrantica.com/perfume/Atelier-Cologne/Philtre-Ceylan-35378.html,,,,,,,,,,,,,,,,Philtre Ceylan Atelier Cologne (unisex) ~ 2016,2.0,8.0,2016.0,810.0,,,,,,,,,,,,,,True
https://www.fragrantica.com/perfume/Hugo-Boss/Boss-Element-5243.html,,,,,,,,,,,,,,,,Boss Element Hugo Boss (male) ~ 2009,2.0,8.0,2009.0,811.0,,,,,,,,,,,,,,True
https://www.fragrantica.com/perfume/DS-Durga/El-Cosmico-32535.html,,,,,,,,,,,,,,,,El Cosmico DS&Durga (unisex) ~ 2015,1.0,6.0,2015.0,812.0,,,,,,,,,,,,,,True
https://www.fragrantica.com/perfume/Rasasi/Sotoor-Waaw-47930.html,,,,,,,,,,,,,,,,Sotoor Waaw Rasasi (unisex) ~ 2017,1.0,6.0,2017.0,813.0,,,,,,,,,,,,,,True
https://www.fragrantica.com/perfume/Chopard/Nuit-des-Rois-55854.html,,,,,,,,,,,,,,,,Nuit des Rois Chopard (unisex) ~ 2019,1.0,6.0,2019.0,814.0,,,,,,,,,,,,,,True
https://www.fragrantica.com/perfume/Areej-Le-Dore/Malik-Al-Taif-52241.html,,,,,,,,,,,,,,,,Malik Al Taif Areej Le Doré (unisex) ~ 2018,2.0,8.0,2018.0,817.0,,,,,,,,,,,,,,True
https://www.fragrantica.com/perfume/Calvin-Klein/Encounter-15279.html,,,,,,,,,,,,,,,,Encounter Calvin Klein (male) ~ 2012,1.0,6.0,2012.0,818.0,,,,,,,,,,,,,,True
https://www.fragrantica.com/perfume/Giorgio-Armani/Sable-Fume-31211.html,,,,,,,,,,,,,,,,Sable Fume Giorgio Armani (unisex) ~ 2015,1.0,6.0,2015.0,819.0,,,,,,,,,,,,,,True
https://www.fragrantica.com/perfume/Xerjoff/XJ-1861-Renaissance-12126.html,,,,,,,,,,,,,,,,XJ 1861 Renaissance Xerjoff (unisex) ~ 2011,2.0,8.0,2011.0,822.0,XJ 1861 Renaissance Xerjoff (unisex) ~ 2011,14.0,18.0,2011.0,508.0,XJ 1861 Renaissance Xerjoff (unisex) ~ 2011,27.0,14.0,2011.0,342.0,,,,True
https://www.fragrantica.com/perfume/Rasasi/Shuhrah-Pour-Homme-53578.html,,,,,,,,,,,,,,,,Shuhrah Pour Homme Rasasi (male),1.0,6.0,0.0,823.0,,,,,,Shuhrah Pour Homme Rasasi (male),22.0,38.0,0.0,613.0,,,,True
https://www.fragrantica.com/perfume/Rasasi/Shaghaf-Pour-Homme-49341.html,,,,,,,,,,,,,,,,Shaghaf Pour Homme Rasasi (male) ~ 2018,1.0,6.0,2018.0,824.0,,,,,,,,,,,,,,True
https://www.fragrantica.com/perfume/Montale/Arabians-45306.html,,,,,,,,,,,,,,,,Arabians Montale (unisex) ~ 2017,2.0,8.0,2017.0,825.0,,,,,,,,,,,,,,True
https://www.fragrantica.com/perfume/Christopher-Dicas/69-Le-Parfum-50456.html,,,,,,,,,,,,,,,,69 Le Parfum Christopher Dicas (unisex) ~ 2018,6.0,18.0,2018.0,827.0,69 Le Parfum Christopher Dicas (unisex) ~ 2018,5.0,13.0,2018.0,952.0,69 Le Parfum Christopher Dicas (unisex) ~ 2018,2.0,5.0,2018.0,830.0,,,,True
https://www.fragrantica.com/perfume/Carrera/Carrera-original-19348.html,,,,,,,,,,,,,,,,Carrera (original) Carrera (male) ~ 1988,4.0,14.0,1988.0,828.0,Carrera (original) Carrera (male) ~ 1988,4.0,12.0,1988.0,986.0,,,,,,,,,True
https://www.fragrantica.com/perfume/Serge-Lutens/Le-Participe-Passe-50234.html,,,,,,,,,,,,,,,,Le Participe Passé Serge Lutens (unisex) ~ 2018,5.0,16.0,2018.0,829.0,,,,,,,,,,,,,,True
https://www.fragrantica.com/perfume/Mahogany/Africa-51967.html,,,,,,,,,,,,,,,,África Mahogany (male) ~ 2018,3.0,12.0,2018.0,832.0,África Mahogany (male) ~ 2018,8.0,13.0,2018.0,676.0,,,,,,,,,True
https://www.fragrantica.com/perfume/Orto-Parisi/Seminalis-38293.html,,,,,,,,,,,,,,,,Seminalis Orto Parisi (unisex) ~ 2016,5.0,16.0,2016.0,833.0,Seminalis Orto Parisi (unisex) ~ 2016,8.0,16.0,2016.0,849.0,,,,,,,,,True
https://www.fragrantica.com/perfume/Yves-Saint-Laurent/Magnificent-Gold-46243.html,,,,,,,,,,,,,,,,Magnificent Gold Yves Saint Laurent (unisex) ~ 2017,3.0,12.0,2017.0,834.0,,,,,,,,,,,,,,True
https://www.fragrantica.com/perfume/Banana-Republic/78-Vintage-Green-45027.html,,,,,,,,,,,,,,,,78 Vintage Green Banana Republic (unisex) ~ 2017,3.0,12.0,2017.0,835.0,78 Vintage Green Banana Republic (unisex) ~ 2017,10.0,19.0,2017.0,792.0,78 Vintage Green Banana Republic (unisex) ~ 2017,8.0,10.0,2017.0,620.0,,,,True
https://www.fragrantica.com/perfume/O-Boticario/Egeo-7352.html,,,,,,,,,,,,,,,,Egeo O Boticário (male) ~ 2002,1.0,8.0,2002.0,836.0,Egeo O Boticário (male) ~ 2002,2.0,7.0,2002.0,976.0,Egeo O Boticário (male) ~ 2002,1.0,5.0,2002.0,922.0,,,,True
https://www.fragrantica.com/perfume/Mi6ka/Wood-Man-52589.html,,,,,,,,,,,,,,,,Wood Man Mi6ka (male) ~ 2015,1.0,8.0,2015.0,837.0,,,,,,,,,,,,,,True
https://www.fragrantica.com/perfume/Calvin-Klein/CK-Free-Sport-23614.html,,,,,,,,,,,,,,,,CK Free Sport Calvin Klein (male) ~ 2014,1.0,8.0,2014.0,838.0,,,,,,,,,,,,,,True
https://www.fragrantica.com/perfume/Calvin-Klein/Encounter-Fresh-18597.html,,,,,,,,,,,,,,,,Encounter Fresh Calvin Klein (male) ~ 2013,2.0,10.0,2013.0,839.0,,,,,,,,,,,,,,True
https://www.fragrantica.com/perfume/Chopard/Miel-d-Arabie-48433.html,,,,,,,,,,,,,,,,Miel d'Arabie Chopard (unisex) ~ 2018,1.0,8.0,2018.0,840.0,,,,,,,,,,,,,,True
https://www.fragrantica.com/perfume/Ermenegildo-Zegna/Persian-Saffron-43536.html,,,,,,,,,,,,,,,,Persian Saffron Ermenegildo Zegna (male) ~ 2017,8.0,23.0,2017.0,841.0,,,,,,,,,,,,,,True
https://www.fragrantica.com/perfume/Gendarme/Gendarme-7190.html,,,,,,,,,,,,,,,,Gendarme Gendarme (male),8.0,23.0,0.0,842.0,Gendarme Gendarme (male),2.0,7.0,0.0,961.0,,,,,,,,,True
https://www.fragrantica.com/perfume/Bath-Body-Works/Mahogany-Woods-32772.html,,,,,,,,,,,,,,,,Mahogany Woods Bath & Body Works (male) ~ 2014,4.0,15.0,2014.0,843.0,,,,,,,,,,,,,,True
https://www.fragrantica.com/perfume/Christopher-Dicas/Christopher-Dicas-Eau-de-Parfum-14054.html,,,,,,,,,,,,,,,,Christopher Dicas Eau de Parfum Christopher Dicas (unisex) ~ 2011,4.0,15.0,2011.0,844.0,Christopher Dicas Eau de Parfum Christopher Dicas (unisex) ~ 2011,3.0,12.0,2011.0,1053.0,Christopher Dicas Eau de Parfum Christopher Dicas (unisex) ~ 2011,2.0,13.0,2011.0,1109.0,,,,True
https://www.fragrantica.com/perfume/Laboratorio-Olfattivo/Cozumel-13009.html,,,,,,,,,,,,,,,,Cozumel Laboratorio Olfattivo (male) ~ 2010,2.0,11.0,2010.0,845.0,,,,,,,,,,,,,,True
https://www.fragrantica.com/perfume/Montale/Oud-Dream-53632.html,,,,,,,,,,,,,,,,Oud Dream Montale (unisex) ~ 2019,5.0,17.0,2019.0,846.0,Oud Dream Montale (unisex) ~ 2019,5.0,18.0,2019.0,1090.0,,,,,,,,,True
https://www.fragrantica.com/perfume/Boadicea-the-Victorious/Azrak-18520.html,,,,,,,,,,,,,,,,Azrak Boadicea the Victorious (unisex) ~ 2013,4.0,15.0,2013.0,847.0,,,,,,,,,,,,,,True
https://www.fragrantica.com/perfume/Rasasi/Chastity-Men-8632.html,,,,,,,,,,,,,,,,Chastity Men Rasasi (male),3.0,13.0,0.0,848.0,,,,,,,,,,,,,,True
https://www.fragrantica.com/perfume/Calvin-Klein/Obsessed-for-Men-Intense-48102.html,,,,,,,,,,,,,,,,Obsessed for Men Intense Calvin Klein (male) ~ 2018,4.0,15.0,2018.0,849.0,,,,,,,,,,,,,,True
https://www.fragrantica.com/perfume/Antonio-Banderas/Blue-Cool-Seduction-for-Men-12627.html,,,,,,,,,,,,,,,,Blue Cool Seduction for Men Antonio Banderas (male) ~ 2011,2.0,11.0,2011.0,850.0,,,,,,Blue Cool Seduction for Men Antonio Banderas (male) ~ 2011,1.0,7.0,2011.0,959.0,,,,True
https://www.fragrantica.com/perfume/Zara/Night-Pour-Homme-V-62365.html,,,,,,,,,,,,,,,,Night Pour Homme V Zara (male) ~ 2020,1.0,9.0,2020.0,851.0,,,,,,,,,,,,,,True
https://www.fragrantica.com/perfume/Azzaro/Decibel-12434.html,,,,,,,,,,,,,,,,Decibel Azzaro (male) ~ 2011,1.0,9.0,2011.0,852.0,,,,,,,,,,,,,,True
https://www.fragrantica.com/perfume/Zara/Warm-Black-62359.html,,,,,,,,,,,,,,,,Warm Black Zara (male) ~ 2020,11.0,30.0,2020.0,854.0,Warm Black Zara (male) ~ 2020,7.0,13.0,2020.0,800.0,Warm Black Zara (male) ~ 2020,5.0,16.0,2020.0,982.0,,,,True
https://www.fragrantica.com/perfume/Carolina-Herrera/CH-Men-Africa-30382.html,,,,,,,,,,,,,,,,CH Men Africa Carolina Herrera (male) ~ 2015,2.0,12.0,2015.0,855.0,,,,,,,,,,,,,,True
https://www.fragrantica.com/perfume/Michael-Kors/Extreme-Night-44695.html,,,,,,,,,,,,,,,,Extreme Night Michael Kors (male) ~ 2017,2.0,12.0,2017.0,856.0,,,,,,,,,,,,,,True
https://www.fragrantica.com/perfume/Kenneth-Cole/Mankind-Hero-38546.html,,,,,,,,,,,,,,,,Mankind Hero Kenneth Cole (male) ~ 2016,1.0,10.0,2016.0,857.0,,,,,,,,,,,,,,True
https://www.fragrantica.com/perfume/Floris/1962-40919.html,,,,,,,,,,,,,,,,1962 Floris (unisex) ~ 2016,6.0,22.0,2016.0,858.0,,,,,,,,,,,,,,True
https://www.fragrantica.com/perfume/Jimmy-Choo/Urban-Hero-56740.html,,,,,,,,,,,,,,,,Urban Hero Jimmy Choo (male) ~ 2019,2.0,15.0,2019.0,859.0,,,,,,,,,,,,,,True
https://www.fragrantica.com/perfume/Hollister/Hollister-Wave-For-Him-38891.html,,,,,,,,,,,,,,,,Hollister Wave For Him Hollister (male) ~ 2016,4.0,19.0,2016.0,860.0,,,,,,,,,,,,,,True
https://www.fragrantica.com/perfume/Roberto-Cavalli/Divine-Oud-41717.html,,,,,,,,,,,,,,,,Divine Oud Roberto Cavalli (unisex) ~ 2016,7.0,26.0,2016.0,861.0,,,,,,,,,,,,,,True
https://www.fragrantica.com/perfume/Byredo/1996-Inez-Vinoodh-19247.html,,,,,,,,,,,,,,,,1996 Inez & Vinoodh Byredo (unisex) ~ 2013,7.0,26.0,2013.0,862.0,,,,,,,,,,,,,,True
https://www.fragrantica.com/perfume/Roja-Dove/Aoud-17930.html,,,,,,,,,,,,,,,,Aoud Roja Dove (unisex) ~ 2010,8.0,29.0,2010.0,865.0,,,,,,Aoud Roja Dove (unisex) ~ 2010,9.0,21.0,2010.0,899.0,,,,True
https://www.fragrantica.com/perfume/Nenuco/Agua-de-Colonia-36417.html,,,,,,,,,,,,,,,,Agua de Colonia Nenuco (unisex),4.0,21.0,0.0,866.0,,,,,,Agua de Colonia Nenuco (unisex),17.0,42.0,0.0,1023.0,,,,True
https://www.fragrantica.com/perfume/Mendittorosa/Osang-44117.html,,,,,,,,,,,,,,,,Osang Mendittorosa (unisex) ~ 2017,8.0,30.0,2017.0,867.0,,,,,,,,,,,,,,True
https://www.fragrantica.com/perfume/Dior/Sauvage-Elixir-68415.html,,,,,,,,,,,,,,,,,,,,,Sauvage Elixir Dior (male) ~ 2021,265.0,249.0,2021.0,77.0,Sauvage Elixir Dior (male) ~ 2021,1031.0,670.0,2021.0,11.0,,,,True
