link,name_17,upvotes_17,downvotes_17,year_17,order_17,name_18,upvotes_18,downvotes_18,year_18,order_18,name_19,upvotes_19,downvotes_19,year_19,order_19,name_20,upvotes_20,downvotes_20,year_20,order_20,name_21,upvotes_21,downvotes_21,year_21,order_21,name_22,upvotes_22,downvotes_22,year_22,order_22,upvotes_total,downvotes_total,order_total,check_names
https://www.fragrantica.com/perfume/Dior/Dior-Homme-Intense-2011-13016.html,Dior Homme Intense 2011 Dior (male) ~ 2011,761.0,429.0,2011.0,1.0,Dior Homme Intense 2011 Dior (male) ~ 2011,368.0,235.0,2011.0,1.0,Dior Homme Intense 2011 Dior (male) ~ 2011,477.0,281.0,2011.0,1.0,Dior Homme Intense 2011 Dior (male) ~ 2011,907.0,412.0,2011.0,1.0,Dior Homme Intense 2011 Dior (male) ~ 2011,1370.0,573.0,2011.0,1.0,Dior Homme Intense 2011 Dior (male) ~ 2011,1689.0,694.0,2011.0,1.0,5572.0,2624.0,6.0,True
https://www.fragrantica.com/perfume/Hermes/Terre-d-Hermes-17.html,Terre d'Hermès Hermès (male) ~ 2006,749.0,423.0,2006.0,2.0,Terre d'Hermès Hermès (male) ~ 2006,277.0,147.0,2006.0,7.0,Terre d'Hermès Hermès (male) ~ 2006,466.0,280.0,2006.0,2.0,Terre d'Hermès Hermès (male) ~ 2006,750.0,451.0,2006.0,2.0,Terre d'Hermès Hermès (male) ~ 2006,1124.0,562.0,2006.0,2.0,Terre d'Hermès Hermès (male) ~ 2006,1280.0,639.0,2006.0,3.0,4646.0,2502.0,18.0,True
https://www.fragrantica.com/perfume/Creed/Aventus-9828.html,Aventus Creed (male) ~ 2010,723.0,416.0,2010.0,3.0,Aventus Creed (male) ~ 2010,400.0,307.0,2010.0,3.0,Aventus Creed (male) ~ 2010,433.0,306.0,2010.0,4.0,Aventus Creed (male) ~ 2010,694.0,508.0,2010.0,6.0,Aventus Creed (male) ~ 2010,1022.0,640.0,2010.0,4.0,Aventus Creed (male) ~ 2010,1158.0,693.0,2010.0,7.0,4430.0,2870.0,27.0,True
https://www.fragrantica.com/perfume/Dior/Fahrenheit-228.html,Fahrenheit Dior (male) ~ 1988,738.0,490.0,1988.0,4.0,Fahrenheit Dior (male) ~ 1988,288.0,209.0,1988.0,9.0,Fahrenheit Dior (male) ~ 1988,432.0,280.0,1988.0,3.0,Fahrenheit Dior (male) ~ 1988,696.0,403.0,1988.0,3.0,Fahrenheit Dior (male) ~ 1988,869.0,493.0,1988.0,8.0,Fahrenheit Dior (male) ~ 1988,868.0,510.0,1988.0,16.0,3891.0,2385.0,43.0,True
https://www.fragrantica.com/perfume/Yves-Saint-Laurent/La-Nuit-de-l-Homme-5521.html,La Nuit de l'Homme Yves Saint Laurent (male) ~ 2009,608.0,305.0,2009.0,5.0,La Nuit de l'Homme Yves Saint Laurent (male) ~ 2009,326.0,214.0,2009.0,5.0,La Nuit de l'Homme Yves Saint Laurent (male) ~ 2009,395.0,247.0,2009.0,5.0,La Nuit de l'Homme Yves Saint Laurent (male) ~ 2009,636.0,359.0,2009.0,5.0,La Nuit de l'Homme Yves Saint Laurent (male) ~ 2009,836.0,397.0,2009.0,7.0,La Nuit de l'Homme Yves Saint Laurent (male) ~ 2009,1055.0,462.0,2009.0,6.0,3856.0,1984.0,33.0,True
https://www.fragrantica.com/perfume/Chanel/Bleu-de-Chanel-Eau-de-Parfum-25967.html,Bleu de Chanel Eau de Parfum Chanel (male) ~ 2014,583.0,387.0,2014.0,6.0,Bleu de Chanel Eau de Parfum Chanel (male) ~ 2014,208.0,133.0,2014.0,16.0,Bleu de Chanel Eau de Parfum Chanel (male) ~ 2014,208.0,160.0,2014.0,26.0,Bleu de Chanel Eau de Parfum Chanel (male) ~ 2014,476.0,279.0,2014.0,10.0,Bleu de Chanel Eau de Parfum Chanel (male) ~ 2014,1148.0,642.0,2014.0,3.0,Bleu de Chanel Eau de Parfum Chanel (male) ~ 2014,1500.0,717.0,2014.0,2.0,4123.0,2318.0,63.0,True
https://www.fragrantica.com/perfume/Giorgio-Armani/Acqua-di-Gio-410.html,Acqua di Gio Giorgio Armani (male) ~ 1996,475.0,312.0,1996.0,7.0,Acqua di Gio Giorgio Armani (male) ~ 1996,100.0,101.0,1996.0,79.0,Acqua di Gio Giorgio Armani (male) ~ 1996,233.0,174.0,1996.0,18.0,Acqua di Gio Giorgio Armani (male) ~ 1996,349.0,223.0,1996.0,24.0,Acqua di Gio Giorgio Armani (male) ~ 1996,533.0,314.0,1996.0,19.0,Acqua di Gio Giorgio Armani (male) ~ 1996,616.0,409.0,1996.0,24.0,2306.0,1533.0,171.0,True
https://www.fragrantica.com/perfume/Dior/Eau-Sauvage-231.html,Eau Sauvage Dior (male) ~ 1966,410.0,227.0,1966.0,8.0,Eau Sauvage Dior (male) ~ 1966,83.0,35.0,1966.0,59.0,Eau Sauvage Dior (male) ~ 1966,274.0,150.0,1966.0,10.0,Eau Sauvage Dior (male) ~ 1966,405.0,191.0,1966.0,13.0,Eau Sauvage Dior (male) ~ 1966,480.0,236.0,1966.0,23.0,Eau Sauvage Dior (male) ~ 1966,422.0,225.0,1966.0,38.0,2074.0,1064.0,151.0,True
https://www.fragrantica.com/perfume/Lalique/Encre-Noire-1834.html,Encre Noire Lalique (male) ~ 2006,386.0,217.0,2006.0,9.0,Encre Noire Lalique (male) ~ 2006,290.0,155.0,2006.0,6.0,Encre Noire Lalique (male) ~ 2006,296.0,151.0,2006.0,8.0,Encre Noire Lalique (male) ~ 2006,400.0,206.0,2006.0,17.0,Encre Noire Lalique (male) ~ 2006,612.0,328.0,2006.0,15.0,Encre Noire Lalique (male) ~ 2006,614.0,352.0,2006.0,23.0,2598.0,1409.0,78.0,True
https://www.fragrantica.com/perfume/Tom-Ford/Tobacco-Vanille-1825.html,Tobacco Vanille Tom Ford (unisex) ~ 2007,398.0,242.0,2007.0,10.0,Tobacco Vanille Tom Ford (unisex) ~ 2007,63.0,30.0,2007.0,83.0,Tobacco Vanille Tom Ford (unisex) ~ 2007,177.0,102.0,2007.0,28.0,Tobacco Vanille Tom Ford (unisex) ~ 2007,390.0,195.0,2007.0,18.0,Tobacco Vanille Tom Ford (unisex) ~ 2007,486.0,238.0,2007.0,21.0,Tobacco Vanille Tom Ford (unisex) ~ 2007,682.0,337.0,2007.0,20.0,2196.0,1144.0,180.0,True
https://www.fragrantica.com/perfume/Creed/Green-Irish-Tweed-474.html,Green Irish Tweed Creed (male) ~ 1985,339.0,152.0,1985.0,11.0,Green Irish Tweed Creed (male) ~ 1985,196.0,108.0,1985.0,14.0,Green Irish Tweed Creed (male) ~ 1985,243.0,145.0,1985.0,14.0,Green Irish Tweed Creed (male) ~ 1985,378.0,205.0,1985.0,19.0,Green Irish Tweed Creed (male) ~ 1985,477.0,212.0,1985.0,20.0,Green Irish Tweed Creed (male) ~ 1985,491.0,280.0,1985.0,32.0,2124.0,1102.0,110.0,True
https://www.fragrantica.com/perfume/Dolce-Gabbana/The-One-for-Men-Eau-de-Parfum-31909.html,The One for Men Eau de Parfum Dolce&Gabbana (male) ~ 2015,338.0,165.0,2015.0,12.0,The One for Men Eau de Parfum Dolce&Gabbana (male) ~ 2015,195.0,106.0,2015.0,15.0,The One for Men Eau de Parfum Dolce&Gabbana (male) ~ 2015,283.0,170.0,2015.0,11.0,The One for Men Eau de Parfum Dolce&Gabbana (male) ~ 2015,494.0,277.0,2015.0,9.0,The One for Men Eau de Parfum Dolce&Gabbana (male) ~ 2015,681.0,325.0,2015.0,11.0,The One for Men Eau de Parfum Dolce&Gabbana (male) ~ 2015,895.0,445.0,2015.0,12.0,2886.0,1488.0,70.0,True
https://www.fragrantica.com/perfume/Jean-Paul-Gaultier/Le-Male-430.html,Le Male Jean Paul Gaultier (male) ~ 1995,395.0,287.0,1995.0,13.0,Le Male Jean Paul Gaultier (male) ~ 1995,140.0,116.0,1995.0,46.0,Le Male Jean Paul Gaultier (male) ~ 1995,230.0,205.0,1995.0,27.0,Le Male Jean Paul Gaultier (male) ~ 1995,448.0,348.0,1995.0,20.0,Le Male Jean Paul Gaultier (male) ~ 1995,549.0,383.0,1995.0,24.0,Le Male Jean Paul Gaultier (male) ~ 1995,581.0,397.0,1995.0,26.0,2343.0,1736.0,156.0,True
https://www.fragrantica.com/perfume/Dior/Dior-Homme-2005-230.html,Dior Homme 2005 Dior (male) ~ 2005,325.0,168.0,2005.0,14.0,Dior Homme 2005 Dior (male) ~ 2005,54.0,36.0,2005.0,103.0,Dior Homme 2005 Dior (male) ~ 2005,58.0,38.0,2005.0,109.0,Dior Homme 2005 Dior (male) ~ 2005,164.0,117.0,2005.0,64.0,Dior Homme 2005 Dior (male) ~ 2005,124.0,91.0,2005.0,135.0,Dior Homme 2005 Dior (male) ~ 2005,215.0,154.0,2005.0,90.0,940.0,604.0,515.0,True
https://www.fragrantica.com/perfume/Chanel/Egoiste-613.html,Egoiste Chanel (male) ~ 1990,295.0,129.0,1990.0,15.0,Egoiste Chanel (male) ~ 1990,188.0,127.0,1990.0,20.0,Egoiste Chanel (male) ~ 1990,236.0,128.0,1990.0,13.0,Egoiste Chanel (male) ~ 1990,316.0,134.0,1990.0,22.0,Egoiste Chanel (male) ~ 1990,355.0,213.0,1990.0,40.0,Egoiste Chanel (male) ~ 1990,288.0,183.0,1990.0,62.0,1678.0,914.0,172.0,True
https://www.fragrantica.com/perfume/Yves-Saint-Laurent/M7-1031.html,M7 Yves Saint Laurent (male) ~ 2002,289.0,122.0,2002.0,16.0,M7 Yves Saint Laurent (male) ~ 2002,93.0,32.0,2002.0,54.0,M7 Yves Saint Laurent (male) ~ 2002,174.0,110.0,2002.0,30.0,M7 Yves Saint Laurent (male) ~ 2002,176.0,85.0,2002.0,50.0,M7 Yves Saint Laurent (male) ~ 2002,210.0,97.0,2002.0,61.0,M7 Yves Saint Laurent (male) ~ 2002,169.0,103.0,2002.0,107.0,1111.0,549.0,318.0,True
https://www.fragrantica.com/perfume/Dior/Sauvage-31861.html,Sauvage Dior (male) ~ 2015,379.0,331.0,2015.0,17.0,Sauvage Dior (male) ~ 2015,211.0,193.0,2015.0,27.0,Sauvage Dior (male) ~ 2015,179.0,208.0,2015.0,57.0,Sauvage Dior (male) ~ 2015,503.0,405.0,2015.0,15.0,Sauvage Dior (male) ~ 2015,645.0,516.0,2015.0,18.0,Sauvage Dior (male) ~ 2015,704.0,601.0,2015.0,25.0,2621.0,2254.0,159.0,True
https://www.fragrantica.com/perfume/Tom-Ford/Oud-Wood-1826.html,Oud Wood Tom Ford (unisex) ~ 2007,270.0,127.0,2007.0,18.0,Oud Wood Tom Ford (unisex) ~ 2007,254.0,135.0,2007.0,8.0,Oud Wood Tom Ford (unisex) ~ 2007,317.0,147.0,2007.0,7.0,Oud Wood Tom Ford (unisex) ~ 2007,433.0,193.0,2007.0,11.0,Oud Wood Tom Ford (unisex) ~ 2007,683.0,308.0,2007.0,10.0,Oud Wood Tom Ford (unisex) ~ 2007,752.0,298.0,2007.0,17.0,2709.0,1208.0,71.0,True
https://www.fragrantica.com/perfume/Guerlain/Vetiver-69.html,Vetiver Guerlain (male) ~ 2000,267.0,127.0,2000.0,19.0,Vetiver Guerlain (male) ~ 2000,160.0,83.0,2000.0,25.0,Vetiver Guerlain (male) ~ 2000,78.0,22.0,2000.0,66.0,Vetiver Guerlain (male) ~ 2000,299.0,139.0,2000.0,27.0,Vetiver Guerlain (male) ~ 2000,361.0,208.0,2000.0,37.0,Vetiver Guerlain (male) ~ 2000,281.0,158.0,2000.0,60.0,1446.0,737.0,234.0,True
https://www.fragrantica.com/perfume/Dior/Dior-Homme-Parfum-27417.html,Dior Homme Parfum Dior (male) ~ 2014,272.0,145.0,2014.0,20.0,Dior Homme Parfum Dior (male) ~ 2014,363.0,234.0,2014.0,4.0,Dior Homme Parfum Dior (male) ~ 2014,363.0,189.0,2014.0,6.0,Dior Homme Parfum Dior (male) ~ 2014,612.0,306.0,2014.0,4.0,Dior Homme Parfum Dior (male) ~ 2014,877.0,443.0,2014.0,6.0,Dior Homme Parfum Dior (male) ~ 2014,1103.0,513.0,2014.0,5.0,3590.0,1830.0,45.0,True
https://www.fragrantica.com/perfume/Issey-Miyake/L-Eau-d-Issey-Pour-Homme-721.html,L'Eau d'Issey Pour Homme Issey Miyake (male) ~ 1994,268.0,145.0,1994.0,21.0,L'Eau d'Issey Pour Homme Issey Miyake (male) ~ 1994,29.0,16.0,1994.0,147.0,L'Eau d'Issey Pour Homme Issey Miyake (male) ~ 1994,67.0,46.0,1994.0,99.0,L'Eau d'Issey Pour Homme Issey Miyake (male) ~ 1994,230.0,112.0,1994.0,35.0,L'Eau d'Issey Pour Homme Issey Miyake (male) ~ 1994,350.0,177.0,1994.0,34.0,L'Eau d'Issey Pour Homme Issey Miyake (male) ~ 1994,514.0,291.0,1994.0,28.0,1458.0,787.0,364.0,True
https://www.fragrantica.com/perfume/Guerlain/Habit-Rouge-Eau-de-Toilette-16.html,Habit Rouge Eau de Toilette Guerlain (male) ~ 1965,276.0,163.0,1965.0,22.0,Habit Rouge Eau de Toilette Guerlain (male) ~ 1965,139.0,86.0,1965.0,30.0,Habit Rouge Eau de Toilette Guerlain (male) ~ 1965,184.0,123.0,1965.0,29.0,Habit Rouge Eau de Toilette Guerlain (male) ~ 1965,234.0,136.0,1965.0,39.0,Habit Rouge Eau de Toilette Guerlain (male) ~ 1965,139.0,70.0,1965.0,105.0,Habit Rouge Eau de Toilette Guerlain (male) ~ 1965,183.0,112.0,1965.0,98.0,1155.0,690.0,323.0,True
https://www.fragrantica.com/perfume/Chanel/Allure-Homme-Sport-607.html,Allure Homme Sport Chanel (male) ~ 2004,269.0,153.0,2004.0,23.0,Allure Homme Sport Chanel (male) ~ 2004,71.0,52.0,2004.0,89.0,Allure Homme Sport Chanel (male) ~ 2004,176.0,148.0,2004.0,36.0,Allure Homme Sport Chanel (male) ~ 2004,167.0,93.0,2004.0,57.0,Allure Homme Sport Chanel (male) ~ 2004,280.0,159.0,2004.0,46.0,Allure Homme Sport Chanel (male) ~ 2004,409.0,246.0,2004.0,40.0,1372.0,851.0,291.0,True
https://www.fragrantica.com/perfume/Chanel/Antaeus-616.html,Antaeus Chanel (male) ~ 1981,254.0,133.0,1981.0,24.0,Antaeus Chanel (male) ~ 1981,124.0,72.0,1981.0,39.0,Antaeus Chanel (male) ~ 1981,198.0,127.0,1981.0,23.0,Antaeus Chanel (male) ~ 1981,245.0,139.0,1981.0,34.0,Antaeus Chanel (male) ~ 1981,235.0,133.0,1981.0,54.0,Antaeus Chanel (male) ~ 1981,237.0,142.0,1981.0,80.0,1293.0,746.0,254.0,True
https://www.fragrantica.com/perfume/Viktor-Rolf/Spicebomb-13857.html,Spicebomb Viktor&Rolf (male) ~ 2012,293.0,212.0,2012.0,25.0,Spicebomb Viktor&Rolf (male) ~ 2012,113.0,65.0,2012.0,50.0,Spicebomb Viktor&Rolf (male) ~ 2012,155.0,113.0,2012.0,39.0,Spicebomb Viktor&Rolf (male) ~ 2012,235.0,170.0,2012.0,44.0,Spicebomb Viktor&Rolf (male) ~ 2012,264.0,149.0,2012.0,49.0,Spicebomb Viktor&Rolf (male) ~ 2012,331.0,192.0,2012.0,48.0,1391.0,901.0,255.0,True
https://www.fragrantica.com/perfume/Gucci/Gucci-pour-Homme-2003-691.html,Gucci pour Homme (2003) Gucci (male) ~ 2003,219.0,95.0,2003.0,26.0,Gucci pour Homme (2003) Gucci (male) ~ 2003,127.0,74.0,2003.0,35.0,Gucci pour Homme (2003) Gucci (male) ~ 2003,137.0,71.0,2003.0,37.0,Gucci pour Homme (2003) Gucci (male) ~ 2003,131.0,59.0,2003.0,70.0,Gucci pour Homme (2003) Gucci (male) ~ 2003,146.0,85.0,2003.0,106.0,Gucci pour Homme (2003) Gucci (male) ~ 2003,104.0,62.0,2003.0,154.0,864.0,446.0,428.0,True
https://www.fragrantica.com/perfume/Mugler/A-Men-Pure-Malt-6103.html,A*Men Pure Malt Mugler (male) ~ 2009,224.0,113.0,2009.0,27.0,A*Men Pure Malt Mugler (male) ~ 2009,180.0,118.0,2009.0,22.0,A*Men Pure Malt Mugler (male) ~ 2009,84.0,24.0,2009.0,60.0,A*Men Pure Malt Mugler (male) ~ 2009,208.0,108.0,2009.0,43.0,A*Men Pure Malt Mugler (male) ~ 2009,209.0,106.0,2009.0,68.0,A*Men Pure Malt Mugler (male) ~ 2009,173.0,84.0,2009.0,96.0,1078.0,553.0,316.0,True
https://www.fragrantica.com/perfume/Tom-Ford/Tuscan-Leather-1849.html,Tuscan Leather Tom Ford (unisex) ~ 2007,229.0,125.0,2007.0,28.0,Tuscan Leather Tom Ford (unisex) ~ 2007,211.0,124.0,2007.0,12.0,Tuscan Leather Tom Ford (unisex) ~ 2007,130.0,59.0,2007.0,38.0,Tuscan Leather Tom Ford (unisex) ~ 2007,207.0,94.0,2007.0,41.0,Tuscan Leather Tom Ford (unisex) ~ 2007,230.0,137.0,2007.0,62.0,Tuscan Leather Tom Ford (unisex) ~ 2007,218.0,116.0,2007.0,84.0,1225.0,655.0,265.0,True
https://www.fragrantica.com/perfume/Mugler/A-Men-Pure-Havane-11444.html,A*Men Pure Havane Mugler (male) ~ 2011,234.0,140.0,2011.0,29.0,A*Men Pure Havane Mugler (male) ~ 2011,166.0,87.0,2011.0,21.0,A*Men Pure Havane Mugler (male) ~ 2011,211.0,113.0,2011.0,17.0,A*Men Pure Havane Mugler (male) ~ 2011,278.0,133.0,2011.0,28.0,A*Men Pure Havane Mugler (male) ~ 2011,396.0,218.0,2011.0,29.0,A*Men Pure Havane Mugler (male) ~ 2011,262.0,116.0,2011.0,59.0,1547.0,807.0,183.0,True
https://www.fragrantica.com/perfume/Dolce-Gabbana/The-One-for-Men-2056.html,The One for Men Dolce&Gabbana (male) ~ 2008,247.0,176.0,2008.0,30.0,The One for Men Dolce&Gabbana (male) ~ 2008,70.0,49.0,2008.0,88.0,The One for Men Dolce&Gabbana (male) ~ 2008,114.0,80.0,2008.0,58.0,The One for Men Dolce&Gabbana (male) ~ 2008,61.0,27.0,2008.0,141.0,The One for Men Dolce&Gabbana (male) ~ 2008,194.0,104.0,2008.0,76.0,The One for Men Dolce&Gabbana (male) ~ 2008,97.0,35.0,2008.0,142.0,783.0,471.0,535.0,True
https://www.fragrantica.com/perfume/Yves-Saint-Laurent/Kouros-735.html,Kouros Yves Saint Laurent (male) ~ 1981,241.0,169.0,1981.0,31.0,Kouros Yves Saint Laurent (male) ~ 1981,118.0,108.0,1981.0,60.0,Kouros Yves Saint Laurent (male) ~ 1981,141.0,136.0,1981.0,59.0,Kouros Yves Saint Laurent (male) ~ 1981,219.0,161.0,1981.0,49.0,Kouros Yves Saint Laurent (male) ~ 1981,265.0,209.0,1981.0,64.0,Kouros Yves Saint Laurent (male) ~ 1981,195.0,177.0,1981.0,117.0,1179.0,960.0,380.0,True
https://www.fragrantica.com/perfume/Guerlain/L-Instant-de-Guerlain-pour-Homme-52.html,L'Instant de Guerlain pour Homme Guerlain (male) ~ 2004,189.0,70.0,2004.0,32.0,,,,,,L'Instant de Guerlain pour Homme Guerlain (male) ~ 2004,26.0,14.0,2004.0,185.0,L'Instant de Guerlain pour Homme Guerlain (male) ~ 2004,35.0,11.0,2004.0,195.0,L'Instant de Guerlain pour Homme Guerlain (male) ~ 2004,39.0,15.0,2004.0,229.0,L'Instant de Guerlain pour Homme Guerlain (male) ~ 2004,4.0,4.0,2004.0,662.0,,,,True
https://www.fragrantica.com/perfume/Tom-Ford/Grey-Vetiver-6697.html,Grey Vetiver Tom Ford (male) ~ 2009,206.0,111.0,2009.0,33.0,Grey Vetiver Tom Ford (male) ~ 2009,79.0,40.0,2009.0,69.0,Grey Vetiver Tom Ford (male) ~ 2009,87.0,38.0,2009.0,63.0,Grey Vetiver Tom Ford (male) ~ 2009,24.0,8.0,2009.0,246.0,Grey Vetiver Tom Ford (male) ~ 2009,195.0,77.0,2009.0,67.0,Grey Vetiver Tom Ford (male) ~ 2009,297.0,154.0,2009.0,54.0,888.0,428.0,532.0,True
https://www.fragrantica.com/perfume/Mugler/A-Men-705.html,A*Men Mugler (male) ~ 1996,234.0,170.0,1996.0,34.0,A*Men Mugler (male) ~ 1996,119.0,82.0,1996.0,52.0,A*Men Mugler (male) ~ 1996,144.0,108.0,1996.0,45.0,A*Men Mugler (male) ~ 1996,144.0,102.0,1996.0,77.0,A*Men Mugler (male) ~ 1996,181.0,129.0,1996.0,94.0,A*Men Mugler (male) ~ 1996,179.0,134.0,1996.0,111.0,1001.0,725.0,413.0,True
https://www.fragrantica.com/perfume/Giorgio-Armani/Acqua-di-Gio-Profumo-29727.html,Acqua di Giò Profumo Giorgio Armani (male) ~ 2015,203.0,124.0,2015.0,35.0,Acqua di Giò Profumo Giorgio Armani (male) ~ 2015,223.0,154.0,2015.0,13.0,Acqua di Giò Profumo Giorgio Armani (male) ~ 2015,280.0,185.0,2015.0,12.0,Acqua di Giò Profumo Giorgio Armani (male) ~ 2015,556.0,321.0,2015.0,7.0,Acqua di Giò Profumo Giorgio Armani (male) ~ 2015,899.0,461.0,2015.0,5.0,Acqua di Giò Profumo Giorgio Armani (male) ~ 2015,1209.0,568.0,2015.0,4.0,3370.0,1813.0,76.0,True
https://www.fragrantica.com/perfume/Dior/Dior-Homme-13015.html,Dior Homme Dior (male) ~ 2011,186.0,96.0,2011.0,36.0,Dior Homme Dior (male) ~ 2011,188.0,117.0,2011.0,18.0,Dior Homme Dior (male) ~ 2011,246.0,176.0,2011.0,15.0,Dior Homme Dior (male) ~ 2011,281.0,140.0,2011.0,29.0,Dior Homme Dior (male) ~ 2011,414.0,220.0,2011.0,27.0,Dior Homme Dior (male) ~ 2011,112.0,77.0,2011.0,152.0,1427.0,826.0,277.0,True
https://www.fragrantica.com/perfume/Chanel/Egoiste-Platinum-614.html,Egoiste Platinum Chanel (male) ~ 1993,173.0,76.0,1993.0,37.0,Egoiste Platinum Chanel (male) ~ 1993,115.0,76.0,1993.0,53.0,Egoiste Platinum Chanel (male) ~ 1993,157.0,109.0,1993.0,35.0,Egoiste Platinum Chanel (male) ~ 1993,260.0,143.0,1993.0,33.0,Egoiste Platinum Chanel (male) ~ 1993,351.0,187.0,1993.0,35.0,Egoiste Platinum Chanel (male) ~ 1993,459.0,257.0,1993.0,35.0,1515.0,848.0,228.0,True
https://www.fragrantica.com/perfume/Burberry/London-for-Men-804.html,London for Men Burberry (male) ~ 2006,191.0,116.0,2006.0,38.0,London for Men Burberry (male) ~ 2006,135.0,83.0,2006.0,32.0,London for Men Burberry (male) ~ 2006,107.0,62.0,2006.0,53.0,London for Men Burberry (male) ~ 2006,158.0,87.0,2006.0,62.0,London for Men Burberry (male) ~ 2006,209.0,157.0,2006.0,84.0,London for Men Burberry (male) ~ 2006,128.0,65.0,2006.0,126.0,928.0,570.0,395.0,True
https://www.fragrantica.com/perfume/Davidoff/Cool-Water-507.html,Cool Water Davidoff (male) ~ 1988,208.0,152.0,1988.0,39.0,Cool Water Davidoff (male) ~ 1988,59.0,56.0,1988.0,111.0,Cool Water Davidoff (male) ~ 1988,146.0,105.0,1988.0,41.0,Cool Water Davidoff (male) ~ 1988,223.0,164.0,1988.0,48.0,Cool Water Davidoff (male) ~ 1988,409.0,277.0,1988.0,30.0,Cool Water Davidoff (male) ~ 1988,431.0,338.0,1988.0,44.0,1476.0,1092.0,313.0,True
https://www.fragrantica.com/perfume/Chanel/Pour-Monsieur-615.html,Pour Monsieur Chanel (male) ~ 1955,164.0,75.0,1955.0,40.0,Pour Monsieur Chanel (male) ~ 1955,10.0,0.0,1955.0,212.0,Pour Monsieur Chanel (male) ~ 1955,119.0,55.0,1955.0,44.0,Pour Monsieur Chanel (male) ~ 1955,147.0,61.0,1955.0,60.0,Pour Monsieur Chanel (male) ~ 1955,132.0,69.0,1955.0,112.0,Pour Monsieur Chanel (male) ~ 1955,162.0,104.0,1955.0,112.0,734.0,364.0,580.0,True
https://www.fragrantica.com/perfume/Yves-Saint-Laurent/L-Homme-734.html,L'Homme Yves Saint Laurent (male) ~ 2006,171.0,92.0,2006.0,41.0,L'Homme Yves Saint Laurent (male) ~ 2006,118.0,51.0,2006.0,33.0,L'Homme Yves Saint Laurent (male) ~ 2006,77.0,47.0,2006.0,79.0,L'Homme Yves Saint Laurent (male) ~ 2006,154.0,101.0,2006.0,67.0,L'Homme Yves Saint Laurent (male) ~ 2006,109.0,59.0,2006.0,134.0,L'Homme Yves Saint Laurent (male) ~ 2006,133.0,67.0,2006.0,121.0,762.0,417.0,475.0,True
https://www.fragrantica.com/perfume/Dior/Eau-Sauvage-Parfum-14811.html,Eau Sauvage Parfum Dior (male) ~ 2012,179.0,111.0,2012.0,42.0,Eau Sauvage Parfum Dior (male) ~ 2012,71.0,31.0,2012.0,73.0,Eau Sauvage Parfum Dior (male) ~ 2012,170.0,105.0,2012.0,31.0,Eau Sauvage Parfum Dior (male) ~ 2012,123.0,42.0,2012.0,69.0,Eau Sauvage Parfum Dior (male) ~ 2012,235.0,141.0,2012.0,55.0,Eau Sauvage Parfum Dior (male) ~ 2012,141.0,83.0,2012.0,120.0,919.0,513.0,390.0,True
https://www.fragrantica.com/perfume/Amouage/Jubilation-XXV-Man-2366.html,Jubilation XXV Man Amouage (male) ~ 2007,157.0,76.0,2007.0,43.0,Jubilation XXV Man Amouage (male) ~ 2007,157.0,77.0,2007.0,26.0,Jubilation XXV Man Amouage (male) ~ 2007,180.0,86.0,2007.0,21.0,Jubilation XXV Man Amouage (male) ~ 2007,143.0,46.0,2007.0,58.0,Jubilation XXV Man Amouage (male) ~ 2007,146.0,61.0,2007.0,98.0,Jubilation XXV Man Amouage (male) ~ 2007,154.0,60.0,2007.0,100.0,937.0,406.0,346.0,True
https://www.fragrantica.com/perfume/Aramis/Aramis-113.html,Aramis Aramis (male) ~ 1966,173.0,110.0,1966.0,44.0,Aramis Aramis (male) ~ 1966,21.0,13.0,1966.0,185.0,Aramis Aramis (male) ~ 1966,92.0,66.0,1966.0,72.0,Aramis Aramis (male) ~ 1966,121.0,94.0,1966.0,102.0,Aramis Aramis (male) ~ 1966,118.0,89.0,1966.0,138.0,Aramis Aramis (male) ~ 1966,134.0,91.0,1966.0,134.0,659.0,463.0,675.0,True
https://www.fragrantica.com/perfume/Tom-Ford/Noir-Extreme-29675.html,Noir Extreme Tom Ford (male) ~ 2015,167.0,99.0,2015.0,45.0,Noir Extreme Tom Ford (male) ~ 2015,90.0,28.0,2015.0,56.0,Noir Extreme Tom Ford (male) ~ 2015,146.0,73.0,2015.0,34.0,Noir Extreme Tom Ford (male) ~ 2015,275.0,134.0,2015.0,32.0,Noir Extreme Tom Ford (male) ~ 2015,448.0,221.0,2015.0,25.0,Noir Extreme Tom Ford (male) ~ 2015,609.0,271.0,2015.0,21.0,1735.0,826.0,213.0,True
https://www.fragrantica.com/perfume/Guerlain/L-Instant-de-Guerlain-pour-Homme-Eau-Extreme-11570.html,L'Instant de Guerlain pour Homme Eau Extreme Guerlain (male) ~ 2005,139.0,43.0,2005.0,46.0,L'Instant de Guerlain pour Homme Eau Extreme Guerlain (male) ~ 2005,97.0,22.0,2005.0,42.0,L'Instant de Guerlain pour Homme Eau Extreme Guerlain (male) ~ 2005,159.0,84.0,2005.0,32.0,L'Instant de Guerlain pour Homme Eau Extreme Guerlain (male) ~ 2005,203.0,82.0,2005.0,40.0,L'Instant de Guerlain pour Homme Eau Extreme Guerlain (male) ~ 2005,164.0,64.0,2005.0,83.0,L'Instant de Guerlain pour Homme Eau Extreme Guerlain (male) ~ 2005,113.0,64.0,2005.0,139.0,875.0,359.0,382.0,True
https://www.fragrantica.com/perfume/Gucci/Envy-for-Men-688.html,Envy for Men Gucci (male) ~ 1998,144.0,54.0,1998.0,47.0,Envy for Men Gucci (male) ~ 1998,39.0,25.0,1998.0,125.0,Envy for Men Gucci (male) ~ 1998,108.0,57.0,1998.0,50.0,Envy for Men Gucci (male) ~ 1998,103.0,47.0,1998.0,92.0,Envy for Men Gucci (male) ~ 1998,126.0,59.0,1998.0,113.0,Envy for Men Gucci (male) ~ 1998,119.0,49.0,1998.0,127.0,639.0,291.0,554.0,True
https://www.fragrantica.com/perfume/Chanel/Allure-Homme-Edition-Blanche-2653.html,Allure Homme Edition Blanche Chanel (male) ~ 2008,151.0,70.0,2008.0,48.0,Allure Homme Edition Blanche Chanel (male) ~ 2008,9.0,4.0,2008.0,250.0,Allure Homme Edition Blanche Chanel (male) ~ 2008,5.0,1.0,2008.0,372.0,Allure Homme Edition Blanche Chanel (male) ~ 2008,56.0,31.0,2008.0,159.0,Allure Homme Edition Blanche Chanel (male) ~ 2008,73.0,15.0,2008.0,148.0,,,,,,,,,True
https://www.fragrantica.com/perfume/Bvlgari/Bvlgari-Man-In-Black-26358.html,Bvlgari Man In Black Bvlgari (male) ~ 2014,159.0,86.0,2014.0,49.0,Bvlgari Man In Black Bvlgari (male) ~ 2014,120.0,75.0,2014.0,45.0,Bvlgari Man In Black Bvlgari (male) ~ 2014,133.0,80.0,2014.0,42.0,Bvlgari Man In Black Bvlgari (male) ~ 2014,225.0,111.0,2014.0,37.0,Bvlgari Man In Black Bvlgari (male) ~ 2014,377.0,218.0,2014.0,31.0,Bvlgari Man In Black Bvlgari (male) ~ 2014,459.0,248.0,2014.0,34.0,1473.0,818.0,238.0,True
https://www.fragrantica.com/perfume/Cartier/Declaration-307.html,Declaration Cartier (male) ~ 1998,155.0,84.0,1998.0,50.0,Declaration Cartier (male) ~ 1998,45.0,32.0,1998.0,118.0,Declaration Cartier (male) ~ 1998,33.0,18.0,1998.0,160.0,Declaration Cartier (male) ~ 1998,103.0,58.0,1998.0,103.0,Declaration Cartier (male) ~ 1998,108.0,46.0,1998.0,126.0,Declaration Cartier (male) ~ 1998,152.0,96.0,1998.0,118.0,596.0,334.0,675.0,True
https://www.fragrantica.com/perfume/Giorgio-Armani/Armani-Code-412.html,Armani Code Giorgio Armani (male) ~ 2004,156.0,90.0,2004.0,51.0,Armani Code Giorgio Armani (male) ~ 2004,39.0,35.0,2004.0,144.0,Armani Code Giorgio Armani (male) ~ 2004,125.0,84.0,2004.0,48.0,Armani Code Giorgio Armani (male) ~ 2004,126.0,66.0,2004.0,78.0,Armani Code Giorgio Armani (male) ~ 2004,170.0,100.0,2004.0,90.0,Armani Code Giorgio Armani (male) ~ 2004,195.0,126.0,2004.0,94.0,811.0,501.0,505.0,True
https://www.fragrantica.com/perfume/Versace/Versace-Pour-Homme-2318.html,Versace Pour Homme Versace (male) ~ 2008,164.0,107.0,2008.0,52.0,Versace Pour Homme Versace (male) ~ 2008,81.0,64.0,2008.0,80.0,Versace Pour Homme Versace (male) ~ 2008,138.0,106.0,2008.0,47.0,Versace Pour Homme Versace (male) ~ 2008,222.0,144.0,2008.0,45.0,Versace Pour Homme Versace (male) ~ 2008,381.0,239.0,2008.0,33.0,Versace Pour Homme Versace (male) ~ 2008,490.0,275.0,2008.0,31.0,1476.0,935.0,288.0,True
https://www.fragrantica.com/perfume/Givenchy/Pi-39.html,Pi Givenchy (male) ~ 1998,161.0,103.0,1998.0,53.0,Pi Givenchy (male) ~ 1998,31.0,17.0,1998.0,140.0,Pi Givenchy (male) ~ 1998,34.0,21.0,1998.0,164.0,Pi Givenchy (male) ~ 1998,127.0,63.0,1998.0,74.0,Pi Givenchy (male) ~ 1998,232.0,136.0,1998.0,56.0,Pi Givenchy (male) ~ 1998,299.0,181.0,1998.0,57.0,884.0,521.0,544.0,True
https://www.fragrantica.com/perfume/Ralph-Lauren/Polo-890.html,Polo Ralph Lauren (male) ~ 1978,154.0,89.0,1978.0,54.0,Polo Ralph Lauren (male) ~ 1978,38.0,24.0,1978.0,128.0,Polo Ralph Lauren (male) ~ 1978,100.0,65.0,1978.0,64.0,Polo Ralph Lauren (male) ~ 1978,108.0,43.0,1978.0,88.0,Polo Ralph Lauren (male) ~ 1978,171.0,110.0,1978.0,96.0,Polo Ralph Lauren (male) ~ 1978,123.0,102.0,1978.0,157.0,694.0,433.0,587.0,True
